id,user_id,name,description,image_filename
a8e3083c-ee01-4088-9ef8-20221c6b3e9e,9f33fbae-d673-4f2c-b267-fbf51f68b186,Jacqueline Tunnel route,Impact entire increase six. Cell single president beat discussion. Other run action entire administration care.,da010145-0e84-471d-bd8a-d3663ad3f1bb.jpg
53d812da-8e21-454f-9b8f-7050b6bec72c,742dff03-58ab-4c07-956c-1f6a77a880f6,Lori Underpass route,"Central individual point Democrat figure. Cup able result nice.
Girl effect forward whatever protect. Until activity instead right. Ago social economy check pretty next.",870df74b-28fd-43bd-a077-173be1849232.jpg
b5fe6492-c354-44e0-9c54-13ff88fbf2d1,484d99e8-a210-4e10-a428-9caa59988636,Franklin Corners route,"Mission art opportunity order community heart.
Available light behavior support happen foot. Method play admit key piece until several. He western management step red situation.",c74d1ae3-4bb5-4686-af6c-f3be226cf266.jpg
4cee6b0b-1de9-4d5e-9a39-9f8e5e9488cc,a975bdc6-6472-44c2-809c-1ba7d0b31408,Nguyen Dale route,Boy want course music theory. Try though for glass impact. Risk debate question loss especially offer thing single.,61e12b62-5eaf-4078-8648-90418a727917.jpg
729504d4-e0e5-4603-a3a8-f7d17f86d19b,9ad52327-8795-421c-922e-0631fa898776,Elizabeth Loop route,Fund finish activity school fight break. Him section practice physical position watch.,65b94940-9ee7-4c96-b3fd-c6de4e967c82.jpg
ff01e8c4-444f-47fe-a130-29e23cd1a54f,c4c34d0a-eaad-4684-b115-fb4ddb6cb198,Rodriguez Square route,"Road population great much by. Notice accept ago decision hour figure.
Call field age any public key study area. Five general film far.",3e5e08b4-6d7e-4bf2-b9d8-c06249c6888a.jpg
58c83731-1269-4083-97b1-8e4a7e67cdee,b11ee1fa-9feb-4e17-891b-7dd1aab7686b,Page Vista route,"Series less season stage person she network. Them court write for. These beat guy generation mind nor hundred.
Civil glass send hope really kid.",7f6ae489-5e99-4c96-ab9b-a54d5ea452f9.jpg
9e9df5a5-d343-420c-8a5b-75c71ff38198,db078e2a-1af1-4cf8-a239-6f507352f019,Miller Pike route,"Wind baby beyond international agent. From may hard car like common. Like source miss change price.
Stay life or. Which accept upon free southern great others.",cf15979c-fd3b-4461-8c7f-65c0fba86185.jpg
feae7868-5bea-4652-8b83-f0e304c40544,b1e97858-5400-4fd4-84e6-dd8c5a3445d0,Taylor Pass route,"Several seek drive move customer plant. Son approach quite care stuff. Design war white fire.
Government the happen budget. Too article party sell leader southern Mr.",aaa9f356-c195-4324-ab8e-ba0162ac87cb.jpg
ab1f6e9c-2c12-4a74-80cc-6ca96364bdc2,f64d6ae3-f7f0-440c-8219-fc45a1bc8e0f,Green Ridge route,"Question maybe data study cell.
Word list season economic. Over spend large option.
Establish police surface piece represent suggest including. Mrs manager hand hotel central short.",1efcb048-41d4-4a2e-9da1-b86f38e5f776.jpg
c99523ba-1c64-4cb8-a876-0306341e9ed5,c6b394dd-3c3c-45e1-955a-bbd25590f2ab,Young Roads route,"Edge the family technology listen he. Return early report later campaign land in.
Away ok such safe.",dc4e2a02-3b58-4823-8b2d-4f865e867415.jpg
ef8a235b-4a12-4311-94eb-316f33b3ecc2,233a67d2-e129-41b2-be74-7133d9ff8073,John Ridges route,"Society source start religious dinner action. Lose take little nearly.
Two person option person hotel election. Standard good account official smile.",660e8c1d-bae4-4867-8ddd-bb2904be7454.jpg
f2f700dc-9ccf-46db-af6a-d91d344daf03,175d1b54-518c-44c9-b1cb-0b66c6ed6112,Mcguire Shores route,"Old able probably study figure take bank. Cut international hear meet. Perform court fly like dark.
Traditional rock else. Someone community age analysis.",b404901c-fae2-438f-b6de-5f08942ed9dd.jpg
29c851ca-a858-4916-b14d-159779604d83,16b76435-fdf9-4dc3-93a0-1ab996b2f11b,Madeline Trail route,"Worry ability evening environmental. Blood community subject beat network phone remain finish. Through total mention former.
Already purpose husband space soldier sing itself.",356daa3b-0dd9-4932-ade0-5edadc236f8f.jpg
9153c24e-6fb4-4e3f-b94f-cc6b05e9cde0,4a396076-7e16-4f51-8bb6-997ba1770d59,Huff Spring route,Vote morning well dog brother. Worker everything defense find. Represent officer whole identify close security along.,89a9126d-aa30-419c-a975-e4accd5933dd.jpg
dfd581cf-4794-44e2-be4c-5f1eed47f53f,142ad679-e7d5-4479-bed4-248c0f54f05d,Joyce Drive route,"Likely catch up message media. Down according morning daughter can.
Also art Democrat law story. Understand rich though wrong see ago. Number less himself her.",3377d6a1-50a2-4cda-a540-0edffca8e99b.jpg
414a2615-be28-4a8c-bccb-375ff3301e37,2831769e-0544-4445-9252-b97383fc42ce,Owen View route,Camera else go ask. Him world bed rather. Anyone top bank ability even.,053964e1-6cfb-44f2-9956-f33246ae420f.jpg
d62ebfd7-dc48-4a55-8ab6-abd213dd5fa8,4af74e2d-9fe8-4bac-a592-4b5f9142d22f,Martinez Place route,"Understand crime once myself hold red. Show they over building for body me.
Approach choose half you window serious. Various particularly too. Idea plant wind protect management no I.",f90412bb-1791-4734-aaed-431feb6871e8.jpg
b08702ce-5a74-4dc2-8345-a872595fd834,891b6f1b-12ba-4fe8-a080-d5a9ad84e8a9,Morrow Circle route,"Trip edge those forward too blood. Shake dog material current information simply affect.
Soldier seem opportunity simply on force. Scientist possible similar hold act smile finally baby.",2ad53098-70a3-4b67-8156-24e1588dc828.jpg
ff4a0c84-8ac6-4e6d-99fa-774f3af8718e,0b049e56-7f98-4abc-bd64-dff210162678,Moore Lodge route,"During threat ready seem police. Kitchen government billion finish individual.
Never music treat wear mother deep. Report find million issue institution goal happy speak.",c3a1ee63-ea36-4704-a1bf-683be93a1e89.jpg
963ee7f2-31f2-4cad-b465-b945d3cbd26f,415a47f8-032b-4e92-8789-66116cd16ee6,Knapp Track route,"According describe social bag sense experience concern.
Rock would pay although though most. Large ten issue story former choose. Social wrong amount behind turn stock smile.",e4a2a68f-af5c-457e-b7ec-00a0ac852c8a.jpg
df371b79-2dec-4fe9-9267-91a637144e06,9b01e3e8-da9d-4e9d-ae57-17eb76577379,Jeffrey Hollow route,"Door as vote again pay. Main fine never Republican man culture century. Majority actually base yet actually wide live.
Live reach site begin employee. Thank than team question.",877786b8-9caf-4b1a-8478-31dbf96c1552.jpg
45686663-a90a-4d6a-a26f-be3971f4ac14,2b844968-e7ca-4b97-bc2e-2cb9fd4e8d91,Kerr Extension route,Her else lay suffer full which where. Summer strong field dream memory pay water. Well option dog data.,e60a5ff6-1353-41c1-a4bb-dfb48380948a.jpg
cfa7be75-d294-4916-a9c3-90c54d50b874,6c8c3243-6350-4688-b6cd-8678ba0a6a8a,Andrews Highway route,Other member discover travel fly. Deep other word pay. Consider land study medical magazine son line.,d56f833f-1be6-4797-b8a2-51701dc5f0b7.jpg
6a533fcb-01d7-4764-be80-432edf3aee37,34dea7d6-385a-432e-8d85-340a6ecaf56c,Ellison Inlet route,"Recently sister officer person. Program have hear on student hour degree.
Worry report hold now strong tax thought. Official age word training real or goal.",cbb220a7-e49a-420b-b4bc-3f784efa4a38.jpg
8a563945-c287-418f-ac8d-2bd62a90ac5b,4287a8a0-8449-401a-a992-69d8f602af33,Cheyenne Inlet route,"Tough outside team while throughout. Candidate end plan. Perhaps station hair statement film.
Specific no pressure your. Court north begin hard agreement.",0dfd9a55-96a2-4c31-8d41-6e55004b219c.jpg
74c98e07-05d9-4660-9d02-644db14ea1a4,5f050a8a-29dd-4674-9d39-a4980c7b80e5,Berg Place route,"Case democratic present pull. Couple though organization blue trouble. Fast act animal population.
Probably when give there throw official. Thought instead say my service PM.",881ec349-09a0-4cd3-9108-c71a5ed2061f.jpg
f75411ef-19cf-48fd-9fea-80c40ce1b7f6,9bea3226-0110-409e-9163-ad431e290393,Brown Ferry route,"Than blood seven never. Create us unit business usually despite.
People skill particularly room community stop tax.
Property upon tree value personal. Among baby enter through white.",8e94ff8b-d0d8-41d3-a52b-636c1e559ede.jpg
701abfe7-c7ed-4e36-b3a6-9efc80697035,c74419ce-d3c9-44ad-949e-2790e685aa74,Michael Turnpike route,"Their first yet according need letter common. Popular over call economic example rate plant.
Result thousand water term include. Interview nice do source network by own.",3624f465-375f-4151-a320-781cd48eac7f.jpg
95f28055-a5ae-44d0-953f-b915054c6f23,e2f3fabd-cca4-4b2c-966f-6fcc564b0f74,Webb Spur route,"Look even so head group option. Medical body thank much analysis media report.
Purpose grow pretty phone easy. Decision body necessary community treatment story. Smile support learn long protect.",7a626588-6f2e-436a-8279-cd87e61e3fca.jpg
5eb09354-3500-4fa1-9374-3bac4bd20ec3,34db2f2a-c861-4059-b13b-c1c301add8f6,Pamela Points route,"Face oil next sit military turn sure sometimes. Total we yes box surface goal. Room home true seven.
Number prevent site fear meeting. Almost itself finally system traditional serious skin.",3b08c59d-b230-4b48-b35a-14bafd510f88.jpg
3700f2e2-e19c-415c-8e9a-4a396442bb8e,34db2f2a-c861-4059-b13b-c1c301add8f6,James Parks route,Guess fine instead network I Mr prepare. Step peace fine kind often themselves. Artist season project which woman.,e6bfd2ba-c392-48b3-b103-e04511fbb094.jpg
063738e2-b6aa-4b55-89a7-d8c3061b5859,39c97465-233d-4e51-8a19-0acacf815285,Hart Tunnel route,Ever go of fact. When alone nearly southern. Window piece site she tough across. Business stuff voice project politics.,e24c7c0c-9c9b-422a-8435-85a3dbf2ebbc.jpg
7bb2cb01-cf08-4ef9-ac15-6c05f0628143,415a47f8-032b-4e92-8789-66116cd16ee6,Phillips Parkway route,"Bag trade interest age behind we. Manager magazine civil only.
Quite follow relate until. Chair election Mrs least those simple rule. Day real have just short term.",cf327ff0-8615-4ad4-949d-dd592dfd52d4.jpg
3613d069-af58-4351-a5c3-dc950f94fbc0,be0f8fb1-ac84-487d-b506-e61e0f677418,Rachel Wells route,Some until miss size low however. Top defense build must just stage full. Parent suddenly threat a through garden.,3dc024df-1388-4c2b-8fc8-58286c63e0c6.jpg
9d2bce1e-26bc-4892-80eb-4e4d7106c4e6,7dd8953f-a7b4-4116-991e-804eafcb117c,Berry Squares route,Top class campaign price. Official indeed raise song road size impact believe. Phone about account term consumer without must boy.,d9fb4234-e43d-46e5-8ce9-ba09dcda448d.jpg
9e75f654-e124-4d34-9332-8442bdff912e,1d5a3de2-ff0a-4f30-b8a9-48552999b4c4,Victoria Extensions route,Statement change media establish physical all. Administration expert from even us travel few. Million man democratic bed once or detail.,b7ca0321-fd2c-448b-a6e7-f2e851aff76f.jpg
e52dfdd3-1dcf-4b0b-959d-aa20d93b4832,a3da07aa-cc11-4e06-b187-797420f0b12d,Susan Key route,Region last sometimes represent no quite price mean. Author create significant democratic. Out race media new approach family people fight. Nature strategy employee.,d0dc2363-a720-48bf-a451-bedae91a49a6.jpg
252bfba3-59d2-4da2-a0f9-86c14bd9ec2c,abbdbe43-602d-431d-8626-0cf50947c4ae,Waters Rue route,"Probably evening security example eight.
Guy avoid peace position. Exist partner explain.",3bcfe648-fa4f-4db3-9959-ae52cd28e34f.jpg
111f58d3-a6e7-42f4-9fa7-f296b59d280b,54da0cb9-5b63-43a1-9574-920f91bfc170,Derrick Wells route,"Large best way someone rock simply majority. Practice return type truth family with should. Rock such light quite.
Could apply street identify hot beat themselves. Heavy reveal too TV day.",264dfbc2-1e5e-41da-9ecd-9828179b1ab9.jpg
4ae3bedf-6e3c-4224-a06d-546954fc30f9,ed827610-7eb4-42bc-875d-8c76b2145f12,Snow Burg route,"Myself health trade financial ground. Care range place state.
Difference southern style suddenly bad well. Deal would here office would government. Raise next above job debate national down last.",501b78c8-b672-44ca-b295-cd25800a4463.jpg
92b7769f-993c-4c7c-906a-544d1d7a7800,a9df58f6-e982-4837-ad35-df1159e6e81b,Todd Mountain route,"Bar fact among arm. Speak catch education star.
Even alone mouth special movie positive by. Hear north forward why. Almost sit particularly allow.",9b33202b-afd7-4d76-a3a8-d9f19988c967.jpg
c1dcac49-852b-4279-bd73-7e39b5c92181,48a998e3-6186-4eaf-9222-bfd408b1d9fe,Michelle Gardens route,Various strategy can drop music hair. Old remember suggest or brother important success. Office mission exactly military military go.,c2f9feb4-edf3-46c0-8e65-f44d11384fb5.jpg
fd74ba7d-a88e-470e-af81-317c02939407,5fdd89f8-c31f-4e56-891c-44f69ca10d87,Hughes Fall route,"Challenge institution job day successful fight. Nearly should own.
Fish quality special upon. Course probably exist way yet under both three. Product data evening top bank statement quickly sport.",00f5f9ec-00dd-4edc-911e-680b754585c5.jpg
d16751db-0b94-485a-a9d0-4d57be505027,719ca6a7-3083-4d8a-875b-ad96dccebfe0,Michael Unions route,"Whatever plant behind often each. Receive consider hard share support people.
Herself account lead memory. With speech charge. Hair nature education student early.",af496612-4435-4a3e-8ca4-0212d7eca910.jpg
a2f9267b-0857-49da-9374-690a4572dff6,5c69676b-6c81-445a-8750-50c4310da778,Lambert Turnpike route,"Main fill employee early. If too much focus end while.
From study series cold wish show number. Data reflect radio chance. Receive leg leader. Father large may skill training occur individual.",894b9c94-2c60-4310-996c-b081aeaf156e.jpg
8222570a-8d27-4895-9963-04df724077d1,01cf7b20-6866-4837-962c-1b151ef9e137,Buckley Rue route,"In why source learn evening practice. Because other lot mention. Center choice discuss.
Respond cup a morning discover catch. State military and response last guy better.",7e3a2cde-147b-4f95-993f-bf381e933990.jpg
ade5fa58-1618-4a55-b811-5dba32e84e07,e3bff071-b2d0-47b6-9d5c-0554842c57d0,Harold Walk route,"Others pick TV age. Approach defense agreement little security any. Strategy happen building religious investment arrive home.
On kind already. Now huge wait must economy type.",23d20730-070e-43c7-9251-eb0b39ba68f0.jpg
4ab9def0-22e4-4036-8534-6fada8d27f40,871d0796-c768-4f6e-b57a-80af08c9e578,Snyder Ports route,"Gun often base finally catch. Best debate collection white stuff write TV.
Most catch speech phone number summer maybe. Stay its move goal. Hospital view animal notice involve choice game tend.",74973bfd-9346-486d-bf2f-0c71cd424114.jpg
72aecf84-6f4e-4f96-9c46-e0ba60335957,373f89dc-9bc1-4856-969a-062302de7358,Logan Extensions route,Take if anything down talk. Age while decide decide ok amount wish. Fund from car police institution name.,9a2b7ccb-8318-43a1-9e4d-1978dafc7edf.jpg
d903285c-6cbc-4617-b045-893932b03d1e,82a3ad03-2839-41f6-a80e-c8eb6b06d381,Mark Ridge route,"Every area generation recent hear cultural fact nice. Expect attention black.
Book network light everybody. Arm heavy could fact.",ba879483-261f-4376-9190-ea5fdf695e63.jpg
d74e0d73-3cee-4a15-b040-8226bb260fe5,538575f4-1ce6-41b1-8392-b7ad2afd937f,Timothy Road route,"Need traditional describe guy young chair not.
Price form skill floor market and prove wide. Toward service simple dream.",a5bf22a8-2807-4120-98ef-12c7e160efcc.jpg
d8d34db1-9eae-4134-8192-7442dfb38bc3,c8f5e99f-e3a2-473c-b2b5-edf7780e7882,Allison Fords route,"Floor lose source scientist. Debate everything hear challenge reduce place rule. Person enjoy condition against report in firm.
State shake rock such. New culture better sign since ask center.",572969b3-5237-46ca-9c52-eca0837bfe7d.jpg
3d6ba9d8-dce7-40e1-8d40-6db0177f1b2a,c112861b-3c9b-45e9-8dab-3f6ce01a9d79,Eric Forest route,Follow instead candidate join. Major grow card style force enter smile. She play management within religious.,db9b8031-a0b9-4303-8bc0-97b3bd43942b.jpg
36eaa266-67af-4776-ab7d-102d9899d747,fbca3e02-ced9-4cee-b641-3b0df383be72,Maria Camp route,"This PM increase firm environment. Size save require western college. Nor maybe enter hear popular.
Speech fear what need.",557cf6c7-ae48-409c-bf8f-b7ba43030fac.jpg
6ef5409b-0fae-4214-bf99-0998da2e804b,6d0d284d-2f63-4bfa-86bd-50e16b21c3f7,Jennifer Villages route,According stock list brother. Himself long meeting mother finish black care result. Couple movement security because.,d66c2f1a-2f6a-407e-8eef-c9dddc560417.jpg
d52a6868-40fd-4ffe-b668-eca3e5632ceb,3b1f6ef2-d8b3-49a7-acc4-a1207bd7cf3e,Alvarez Parks route,"Good hair degree ability. Throw together family food one leg.
Source western front world thousand large media. Get brother challenge thousand themselves. Art attention bar player edge.",236fe1c2-03e6-4d56-882a-c92c08f9aba2.jpg
d03dd978-d006-4860-93e3-bb179a7683eb,8965501a-70ba-490d-a907-842ea70e3377,Odom Shore route,Since amount newspaper option good specific whatever. Any production benefit right develop close in.,fb197e0b-fbe0-4c81-8dac-00fad1570b7e.jpg
cf6f4eb9-a727-4b78-93e2-adfa69e9076d,be0c4021-f48e-4c77-92ce-d12e1f339645,Ayala Station route,Daughter these spring research not then. Operation film control cultural. He those machine none.,2fb5426b-ca66-47a7-8c16-32d03b263572.jpg
436ae66a-43db-4cc9-bfb4-70745a66e96a,cd416eae-6d8b-4b03-80d5-3a6c4ac3179d,David Cove route,Though majority including seem public their management. Pull option marriage page wrong organization inside strategy.,fa2bda37-d3f5-4ab6-b5e0-bfdb738f1774.jpg
5836d57b-1886-42f7-b079-715bfe2de0ba,f2d986b2-267f-42b0-a30d-ae1b2ef24455,Scott Centers route,"Process strategy agent first front item recently. Land tough professor.
Respond car throw can. Region white cut.",e676fe07-ffe7-43cb-8b8f-57ea0907ac24.jpg
acc8b987-6759-4332-94c8-cb5bfac12ae5,96b3816d-cbb2-4711-9481-08038012510b,Harrington Flats route,Street former plan TV air. Open eight leave visit small another. Road film watch themselves for voice show.,d57987f9-df86-474d-adac-85d8c6677ef6.jpg
4219b684-1e4e-402e-b7d5-d235d8cfb756,a1863af9-7754-49e9-af5e-9eb86e1b72ec,Kristina Valleys route,Network adult serious smile beyond resource. Drive attack spring west there thank physical. Tv these industry put various current last. Military matter region student.,ce0620b9-d08b-4359-a096-ca53fcbbd953.jpg
8364ede6-9128-4ef0-ac73-2ab837f71df9,7ec63a4f-a407-431d-a521-b950c3b31da5,Thompson View route,"Take another break wall. Serve window usually through form everybody.
Leg window everyone few soldier federal stuff think. West learn worker. Herself miss ago defense policy wait wonder rule.",b0e3c138-c953-42c6-8875-ea5288e72ed2.jpg
7c0abb0c-572c-4933-9f0e-fc347d47c41f,a9b00f16-041e-41ca-8a6d-bc2b9bad596e,Newman Key route,Read everything special field marriage choice sound particularly. Treat bag control sort almost. Middle yourself like against central itself professional. Evening soldier enter source.,418b0e50-073e-49ec-91e4-e5fe16cd8efe.jpg
014c2134-3f32-49bf-aa72-45e706ed8fc6,c9c2887f-4e20-4b24-9571-a8760feb3cf3,Lambert Route route,Woman cause according reduce truth commercial dream. Able military training way across. Your management hope stand purpose live.,d6c5f3e0-9580-499d-97c1-c66885d7d99d.jpg
0579246b-6342-4699-8240-40502ee76108,4ac9c380-af6f-45ca-a541-0b261246943a,James Curve route,"Structure pattern class guy have. Wife send listen fear reveal myself eight. Seat away minute film go term spring form.
Single two pressure rise turn current bed. Difficult role born fact.",07ccc8c7-e6a3-4adf-9187-b985315abbaa.jpg
5d2d415e-96c1-4e1b-96c1-683b7274a002,b7d22f79-5c43-4ae1-ad8f-1d956a61ef97,Griffith Gardens route,Improve floor practice fine. Sport clearly teach appear smile medical mind. Clearly investment reality run.,91568a96-1a14-4683-8274-9f6cc745c134.jpg
12066422-4ccc-4a4d-bf68-89d4a0c8bc83,513056b4-6c88-46bc-8dd0-702e1aa6d68c,Harmon Vista route,"Letter speak second much size real food. Sea test operation road must watch tree despite.
Thing stand positive particular. Light start line condition large.",95f6cb4c-dcb2-489e-9510-3b30a4b7e945.jpg
dc3b2fcc-846f-43bf-a4e4-22b085b0e02e,1a8ec08f-6d33-4846-8abe-e7f1fbb1532e,Garrett Spur route,"Discussion approach animal beyond fact. Half big kid road current American.
Act somebody present morning strong again news. Environmental significant factor middle recent.",b0e344f5-7f0a-402d-8711-7384082efba3.jpg
70db506f-6ac8-48af-8286-5ca36f5ffa52,41eadca3-e790-472d-a989-6902846993e1,Edwards Island route,"Edge present company bring. Determine by eight step. Popular let result evening receive technology nor.
Available member career evening. Add surface ground very answer. Song seek statement four.",47212a0a-9250-4f46-9b35-75f94f724d14.jpg
47f427a8-5283-4103-8243-ea2f02b098af,3994e86e-d5f4-4c8f-9842-34a1353dcc16,Spencer Courts route,Close happy author heart. Site choose security. Less property hotel hand keep. Right attorney night research nearly something still.,e54917f8-2ce0-4fea-a8ee-f9624a214164.jpg
8bda1def-06ed-4acd-88b5-a01a2159339d,6d351b5c-db26-4165-a73c-da3cc4fbd499,Tyler Centers route,"Wonder north risk baby. Gun mean million out recognize. Black he statement conference eye.
Instead kitchen discussion.
Attack back wide development for. Again environmental night already place.",04336119-d93e-4729-823b-c4d879652ce7.jpg
fb6a3b6a-3663-4707-a248-e1d817e8e02f,9b87826e-8bd9-40b3-aec3-a0712bf6a60a,Harvey Canyon route,"Eat hear these growth. Campaign thus mention student require. Represent environmental including door.
Figure former century ok story general official he. Senior window country individual under.",171bf816-333d-44f2-b88c-3125ab06a978.jpg
dad05fec-6ed3-43d7-a372-a36c5c2cafe2,c74419ce-d3c9-44ad-949e-2790e685aa74,Moore Fall route,Admit religious ball his upon live early mouth. Mr direction authority woman nation behind. Audience involve right list red drop practice.,e7cd1717-5fe2-4b6e-b2d9-564bc0894cd4.jpg
8250a8bb-b8b1-48d3-8eb3-a027f782d035,4d98723d-7f80-412f-b5d6-1fe43bfcc0aa,Debra Ville route,"No maybe watch central. Maybe town smile bad threat.
After support forget out. Upon modern station fine. Decide project send grow court.",55ca5d61-e3dd-4c21-8978-f126433f63ea.jpg
47b25ebc-fa48-4ee0-aa46-ec496db2a6b2,9b87826e-8bd9-40b3-aec3-a0712bf6a60a,Dawn Crest route,"Here natural them home industry require perhaps.
Tell would cover. Feel everybody war doctor car plant discussion be.
Feel friend last tax. Any establish pay exactly there heart model.",16efd1f0-fdd3-46b1-bb4a-aa41fc086195.jpg
447ebd22-8a0c-47c8-8950-fdc005794bec,5aa967d4-58e4-42ed-a77c-a26634def87b,Christina Run route,However system learn get. Gun star fear side its head serve other. Under common fast shake plan.,24ab1236-25a4-4ea9-b715-31a121e381db.jpg
854ae341-5162-4b8f-b881-a131b98265a5,40e219c2-318f-45f8-93cb-3cd5803ca276,Nelson Island route,Activity left spend arm for boy. Position relationship option partner pressure sometimes. From give another whole. Another space take source deal.,0e91c73f-9f75-4137-84f5-fa6286d8e191.jpg
2a6e0592-7510-4612-a3fa-245655fa7ce8,55286edb-e1e2-47d1-ac62-1e34d2c683d2,Carla Ridge route,Follow avoid put order practice education kind. Practice Mr however detail fire visit collection sure. Her likely piece field.,e2ba4487-e523-436a-8dbd-9035c8b8823e.jpg
4b5bac38-9c42-4e0a-95b5-c4191afefd2e,bd2f4a81-1c67-4238-9400-192448d9ee9d,Sharon Lodge route,Factor single discover maintain return city him. Room international line line. Able former significant similar energy physical test.,3572752a-db51-42c0-a83c-67722ca111e7.jpg
b705a52f-620e-4def-b3f7-4d3901bff16a,71f90bdb-6aa0-4f3d-bfe5-981a849c3d55,Lawrence Trace route,"Score budget before outside keep method glass. Threat nothing indeed direction serious drive.
Son matter over relationship. Reveal walk analysis team. Because not data poor behind article.",9de5ab0f-7c0d-47fd-9520-c9619f0497e6.jpg
f6fa4985-d340-4a1a-af46-91127f9cb9d8,69bb33c1-f902-4a16-bb32-ef0141f3a8e6,Molina Points route,"View unit responsibility set sit. Sort whatever wide throw executive take area police.
Will manage style perform note stuff wait. Term agreement happen. Home house commercial.",ca866786-615f-42eb-819e-385cd7740013.jpg
26fef127-c2d5-41ab-ad20-07495e4daa59,519c60ea-67be-4181-b40b-7d5bf7bb25b9,Adrienne Walks route,Detail matter choose class power somebody join. Theory ever former.,a6c72d3f-62ce-4509-aeb8-d6e50d841b63.jpg
99aed215-144b-4c93-8006-b996875256b5,bbdd17ce-e8c1-4aa4-addf-72945d5750f5,Wilkins Ford route,"Contain gun force deep. Card business prevent actually nearly.
Work war drop today civil sit. Leader thing look still. Kitchen especially professional catch area.",e328bcc4-1c7f-4e1c-b23c-38a3813393a9.jpg
5c65b298-f600-4241-a921-e7c47d8847f2,2cd619f5-f9a2-49f2-b286-9dce47637623,Anita Rapids route,"Floor hard century effect. Career mind memory. Day be charge spring.
Knowledge may likely central perhaps hospital career. Into ago building poor crime century.",9dcf4d5a-336e-4efc-9955-bd240e9e7d97.jpg
d0ae5ccf-9caa-4efb-88fb-1d60d201ed22,6d0ff584-3524-46ca-8334-17093f4b91ee,Dillon Overpass route,"Card traditional image may especially just letter name.
Machine black today. Both response carry line.",3421ee05-251e-49ba-922c-82f1289c1cb6.jpg
055fad1d-089e-42ea-b312-ead8dba06246,43aaf152-d7ab-4740-bb79-7b2f2d9481f9,Green Parks route,Like fund suffer adult everyone black do. Hundred month speech. Candidate head director manager. Serve writer sing.,33a75720-0537-4688-8e0c-c7595c30e303.jpg
33635a50-4240-416e-a061-b2794cf57889,6d0d284d-2f63-4bfa-86bd-50e16b21c3f7,Wanda Manor route,"Rather young once visit meet network. Much behind business before. These account under themselves stay still southern.
Close seat art color mention itself. Stage story expert wife.",947de79f-5f20-442e-a66d-e51994d28d04.jpg
4ccdb7ca-3cae-4316-a6b9-3f6ca385465e,089f5f77-7008-4a22-b7b8-cc6a130b5039,Tracy Green route,"Pass west already one speech travel. Work sport per throughout.
Thus talk brother then audience. Where whatever book simple car do.",d4c90fe6-7be8-47b0-9bd2-8667c02038b0.jpg
fd3f410e-86cb-4179-80cc-5e926897a317,705dacb9-b82e-4127-a362-ba003c702285,Jennifer Roads route,Run card much nation article population finally. Research least pattern lawyer stock ground month. Page against force ahead pull family last yeah.,a147437f-4252-4a10-8c6e-4627386b9298.jpg
