id,user_id,name,description,image_filename
1a9dd6a4-f6eb-4eb1-a982-d2ded476d1ef,cf632863-3478-4020-bb70-29976ac884c8,Ashley Key route,Though morning look else computer assume. Recent continue maybe floor. Security them worry think season should.,95458a3d-775b-4f41-8ed2-7be4d15efef3.jpg
0774fcfa-161d-4b03-821b-71450509fcae,0a5a88e9-8764-483b-8d09-39208ef54a4a,Bauer Flat route,Range clear three my check. Every field popular school industry through bring none.,e247486a-39b2-45c6-a085-d60d4c3ac7cf.jpg
c4aec3d1-c75e-449c-be24-f5c7209e1296,164f7fd4-cacf-4379-9308-2603d4a0dc8d,Mooney Green route,"In red increase former suddenly music crime. Social weight friend debate toward.
Letter drop Mrs late. Right while room bar south first. Whether responsibility kid foot any.",6a3ec9aa-198f-41e2-8b4f-01f8fc6dceb8.jpg
6f452956-a11e-417a-a37f-451b5f2613ef,e9b2c2f3-72c8-4820-ba15-42e4c54ad596,Cynthia Grove route,"Ability example against again grow including something. Might prevent hot who language. Poor culture charge free year.
May number successful type stand. Especially travel notice into.",c60dcba5-d810-4afc-a17e-0901c7e5750f.jpg
2c4ad005-c194-4c8e-bbaa-5b3bed9829dd,1d5a3de2-ff0a-4f30-b8a9-48552999b4c4,White Hill route,"Far conference could arm whose thank. Thing decide budget free result. Think though spend thought. Help part ever trade.
Cut often cup total ever quality early.",db8edfdf-4277-4599-ab4a-9696f2fd5c24.jpg
61477907-e3da-43dd-bae5-6cb89a3cfae9,3b30f49a-c92f-4337-a6b4-79e776c17150,Hill Crossroad route,"Reflect third add reveal soldier cup wide. Country guy only.
Range knowledge technology arrive relationship maintain however role.
Decade fall movie daughter sea firm.",633caace-1ade-4c72-95aa-1f0c9b31911b.jpg
a2b895b9-b516-473f-80d7-419fdd358c8c,82f52786-a4e7-468d-8618-100cf4d3fb7a,Sims Trail route,Up American ball. Front scene million energy tax theory audience. Why pay response data ready population.,51026646-4a11-49e2-873c-cad8b1ec48b0.jpg
33026a1c-a6d9-46c3-b34d-82e32d8b1aec,bd2f4a81-1c67-4238-9400-192448d9ee9d,Patel Forges route,"Voice because order local yet sing senior.
Decision analysis past notice. Add relationship six international available sport.",b4e58c95-794a-403d-b027-360757044ea8.jpg
b1ae784b-6b3d-4cfb-964d-13ee78bce9bd,459f3ca1-2721-4e6d-a0f4-ecf4ba9a17e7,Brown Mission route,"Help way call call require defense participant box. Start discover southern piece.
Simple shake wrong term. Man election service guess. Year product name remain economic.",a6001f29-5761-466c-8a19-799be76b6de6.jpg
0f320c80-26a2-44ce-a7cc-6653ab47c462,e73836be-7439-4ad7-9834-d18acdb8de8f,Lee Tunnel route,Audience knowledge by before worry them. Everyone raise quality car relate. Although economic computer similar good. Tough reveal as thus only fast several.,e52505de-3fef-44cf-aeae-f1edc3d557a7.jpg
f1a4a379-8914-426a-90ed-eaf2ea488cfb,3bc06f5a-3ed2-4554-ad60-13cefeb5dec7,Juan Shoals route,"Another born always society. Each particularly far word. Lot born sort others discussion.
Event discussion mouth small weight research. Various leg kitchen.",bdaf3cf4-b9be-476a-b1e6-5c23becac4b0.jpg
f81d5a55-a7f5-4232-a9e0-f95ff48d43da,12fbfdaf-e087-4127-ae11-8392c4014f23,Daniel Fort route,"Mr federal paper accept he attack choose. Authority key size view kitchen others.
Easy forward decade person phone within. Past card claim. Also clear institution continue actually office.",cf2e014a-cc94-4667-8c18-74a7ce7cf3fa.jpg
9bad8d71-0c1e-468f-8953-1dc64c7725ee,550ce0ac-9b40-4ddf-a16f-a785c846141d,Shelton Roads route,Blood among case teach. When detail occur fall. Sea have minute but audience movie business responsibility. Poor be child add wish travel.,8ebc49c2-2a98-468b-a171-f62e1fccf87d.jpg
f0a25a9e-fe15-43fb-b92e-3e9f9cb3a2c9,5d1da2f5-cdff-4012-8678-6bd5f9d64b13,Lauren Drives route,Moment risk certainly better bag source heavy. Former get force herself color. Month beat defense only.,f6dc8494-673e-472d-869a-75aef14530bc.jpg
102399b4-bd5c-4275-83c5-1aaf9b77339e,9784dc8e-cc93-4b72-968e-c82071c6d108,Carrie Branch route,"Run box along run short factor unit. Per industry space always. Beyond lot office two woman side voice.
That around thing they place mother character.",5540ad8f-914d-445a-a480-be512afcfc5a.jpg
8452ecf6-b487-40bf-9cdf-b73637e59a15,5c69676b-6c81-445a-8750-50c4310da778,Barnes Port route,"Kitchen news two Mrs bag every teacher. Land organization blood challenge great course.
None skin body. Meeting several enter talk. Center change hard condition fear itself.",1a73678b-f2bd-41b9-b0c7-ad0b3ef832c7.jpg
15dd13ae-ad9b-462c-a2d5-91bfe29eff41,d55bb729-a7c7-4f6f-92a2-e926ce4bb1fc,Hatfield Centers route,"Conference which surface like both pretty. Employee data word meeting tell its soon. Relate man admit assume could size.
Although then four talk partner minute without red. Sell crime show suddenly.",18b8c33c-1842-45f5-9d0e-fd022cbd2684.jpg
641f259e-09ba-43e1-a27c-cb4ce3dc0ee2,fabb0185-6a7c-476e-81a4-f63b54c6286f,Stewart Haven route,"Success positive society society. Sing part tonight option.
Amount on fly couple song. Remember material would go. Than among soldier finish necessary of understand.",7fa64814-2538-46fe-bd54-fd2d0c84e1fb.jpg
e86a0d5e-8a65-4135-8ee0-8449b1dbf747,c54098b4-9f7f-4573-99de-e173677c6725,John Trail route,"Minute audience west another possible hope view race. Right interest watch network enough.
Rule new director read ball. End wonder third seem family.",74b17ddd-dfad-4e34-a5c3-c8e2e0ff91c1.jpg
fea82a84-0580-4282-8fdf-4cd9e1489687,4138fb58-7b61-4f1c-95f5-55759d3560df,Harris Terrace route,Major machine one design treatment party college south. Including some wife close walk seat case. Think design study true.,e2352362-0866-4a6f-b814-961ab9d5801d.jpg
20fdad62-56f7-4aa9-b73d-3b0aa50baf05,cb564f13-d0ce-4f89-83f6-60fe6e8ff841,Gregory View route,"Sense popular office common. Strong spring brother so baby.
Tax parent four few say simple as. Director line one wall school message.",b9f46054-dc05-44d5-9688-5333ff995c0b.jpg
9425e02d-4c44-462d-ae52-1c6bca94d302,4118f5f3-3f94-4350-833a-7f0ed77a69b7,Joshua Parkway route,Identify small arm all here. What serve learn project there perform purpose southern.,aedc852a-5160-4577-b071-0dcc3ba437b8.jpg
0ba9df2e-3ec9-4764-94aa-16955e02b99a,9c6e40e3-945a-48e9-8d61-9b065f1cd28a,Emily Estates route,"News real American turn. Attorney much likely bring time need specific.
Claim just idea. Party bed politics war. Republican door finish sing task.",3817b760-1753-4157-ac81-1f31b1fef565.jpg
43673147-870b-411b-9d03-a65e184dcf67,0b049e56-7f98-4abc-bd64-dff210162678,Stark Common route,"Owner later space help adult always.
Bill team management. Foot police service light.",92142ada-49b1-4bd3-8795-30f721168823.jpg
6e54d2d6-ad6a-4d4e-bcad-a720ad76deaf,e2a53342-fb05-4dbf-91e6-aebd9f65ceb0,James Passage route,Maybe community become rather necessary personal. Kid indicate exist before performance trade firm law. Catch color crime hear it.,4612fcd7-94d8-4fe4-8c2e-56733ac7660c.jpg
5ac371c1-8be6-47ac-b8ab-c71d98c7f2da,e2f3fabd-cca4-4b2c-966f-6fcc564b0f74,Oneill Ways route,"More couple writer second remember.
Growth technology produce property senior seven conference executive. Social education eat brother young rest. Expect build outside road call identify.",b678b3ff-5e9c-4a29-9f20-0d8920d05ad6.jpg
dd858c32-0bc1-4b6d-9ae1-fc3a7a75a26c,f8b88ccd-5fa2-47f2-8649-c5d9d6b4a514,Nelson Landing route,Light sense produce social field collection author into. Election wrong camera do station yourself. Owner statement company present.,d4deb569-05ad-4daf-94b7-a9a8f1301177.jpg
6eee73dc-4921-45e5-a5af-0187c21a7e41,373f89dc-9bc1-4856-969a-062302de7358,Erica Circles route,"Focus to old degree feel energy once gun. Share realize mention use thousand social.
Ball nearly determine mission when player. Word budget within forward woman raise.",72b52aa9-8bd1-4bba-a53b-f33023038752.jpg
8e94bbb7-db6f-4150-bdaf-362b7a89ee6d,e85324e8-f096-4987-8013-140dc665c371,Smith Tunnel route,Visit throw commercial again everyone. Game past ten executive laugh. Wall mission soldier.,367ee76d-f1f6-425e-9aa9-e9e65cdd093d.jpg
4f854f01-1a07-4045-bab9-956715971da1,a707f213-1e05-4e86-9294-9a17d6d86071,Kathleen Common route,Trial avoid all. Produce capital traditional determine may guy PM. Adult stay thus open talk indicate tax. Fear across hope exactly way who.,294f8aba-4d2e-4fc0-a4a7-5acd8a6530a8.jpg
93b779be-3428-4476-8110-4bc653a024ed,be7ce863-cb15-472e-b6fe-04776515366d,Smith Junctions route,"Dark other test ready respond name.
Woman site meet each recognize. Hear economic west.",c5ecbbc3-92a9-41a8-ac56-c4552bb5c17e.jpg
d3b88be0-5936-42a1-a67d-e77aa38e8db8,61a70b9a-3709-40ec-acb4-61eba10e7983,Atkinson Stravenue route,Left science watch street company effort. Owner budget write trouble.,21fc4df1-a0f9-4209-8f0f-4012b12fb0f8.jpg
12fe2e4b-c108-46ae-af49-6cef460bc848,fba4c470-9c4a-4a8c-a9a2-296ef6c4be7e,Brenda Tunnel route,"Direction discuss report provide later kitchen. Floor our news person product water.
Court hot prevent whose machine traditional when. Job manage ability power another provide whether.",296bb89b-68e0-4a46-b51c-18cab8e0ba6a.jpg
4ef12398-df16-4650-9521-c586e7edcf91,a9254a13-61ef-4f9a-be98-badd26e805db,Barber Point route,Else include past mean other draw. Season election without material early. Computer state lose space eye cell animal.,d5ea1ac3-cbea-46d7-b061-ffefd9cb9702.jpg
10982778-3f22-472e-bcf9-e5944ffbe8d0,d14073a7-fad5-4772-aa3c-7235a05012ff,Jason Pines route,"Not imagine final base son ago rich.
Per almost benefit these value.
Born huge many imagine far enough. Democratic per situation control leader head.",22c704ee-7f83-4613-8c63-dfc1baa57ae0.jpg
ca658097-24a1-475c-a279-64c044cc4008,fa0192a6-ea01-44f2-8c7e-32e1a3227607,Walsh Alley route,"Generation item do Congress. Each national general report special model. Like sister human occur.
Set window red season support attack. Room arm side billion.",1bad5111-1544-4b95-af13-b821bec3dd51.jpg
04b525fd-e9bb-47d6-a442-c516f731027a,49f94871-3565-46ef-ae77-7ddb869ec159,Jackson Fort route,Impact meeting similar various. Certain though health current behavior. While administration short Congress their. Want read cultural six put.,b6b091fc-f95e-4e90-9e9a-2474a8065c51.jpg
4d657360-461c-4d3b-96cb-d38d401c2a10,7dd8953f-a7b4-4116-991e-804eafcb117c,Valdez Islands route,Decide program because modern. Seek until live Congress activity billion wear. Better write approach should see whatever.,a3b271a9-bddc-45f9-8afc-5d94ac2693c6.jpg
c2280387-025e-4a81-9214-46c1a5f29d12,c74419ce-d3c9-44ad-949e-2790e685aa74,Colleen Alley route,"Mrs spend raise machine when sister. Authority true western best specific ever ball sit.
Them listen bed work where. Start amount ever walk rise. Child heavy these.",494341d5-5823-4adc-9424-915b5ba003fd.jpg
19f94a4a-7224-407e-83cf-ac9a8987ce26,8e175634-b8a7-43c3-9b5b-1d7f515b47b9,Williams Shoals route,Sign bag price sign hot. Project writer anything for event. Measure lose its adult.,18da8fd3-028e-4eca-b5dc-b8e907502dc4.jpg
0dfb420d-cf0a-47a6-84ed-b47dd1860f36,260754d4-d34f-49ad-9cc6-3680b1ec9bdd,Ana Pass route,They scene appear always show ground maybe argue. Ball pay determine project place room.,d4f98bd9-d0b1-41e6-8702-ad6aa878e997.jpg
cd8c3501-56fd-4dae-bad6-04b279f75023,233a67d2-e129-41b2-be74-7133d9ff8073,Walters Loaf route,Training woman population rather effect sister oil him. Behavior structure child will experience product. Bill soon soon manage water.,782d2ab9-4e30-46f9-ab02-a3a372a05716.jpg
1f904475-0108-41fd-94fb-2c9114c0c2b7,94e4b726-a31f-44aa-8c44-d511bd6032c8,West Mount route,Run economy order activity local. Visit business capital probably voice ago approach. Light company husband subject speech help final.,c88e5692-0d32-4bb6-b978-d41757f16615.jpg
08180e98-cda3-4059-a0f5-f1b8376642ba,a1a5e8cc-c886-4ad5-9ba4-27437e50aa88,Carter Crescent route,"Practice hundred boy put color. Laugh where truth how throw. Catch party car.
Most pull everyone already through reflect meet purpose.
Benefit fall attorney daughter. Without TV campaign grow.",d85fc98a-8eec-48a5-b4a3-681e1e76959d.jpg
96dd746d-a214-438d-a7d5-626e7c77400c,a1863af9-7754-49e9-af5e-9eb86e1b72ec,Reginald Ford route,"Service tell however skill. Participant customer dog name something would.
Body method how right dream move. Particularly fish fund theory conference defense cut. Early few say able while fine.",e849f171-b676-4464-bff5-2116d967bd14.jpg
bfa59490-4d3f-4966-bd12-278611e3947a,fba4c470-9c4a-4a8c-a9a2-296ef6c4be7e,Erik Ramp route,Stand most money allow series. Admit former probably kid woman. Never sense car trial loss southern.,bb0c7e86-0b18-446a-ba0b-502908b6614b.jpg
19b49f4f-5498-4c33-b69e-cf7df01e0193,82886e6e-9395-410b-9f7c-173c0dd61c1c,Carlos Manor route,"Smile work design class. Sound free sit society move.
Increase cell action feel anyone along end act. Development friend six.",82fdba4f-a1a6-4e99-bea3-bd6d5436cbff.jpg
6e2c75eb-4edc-4d2a-8683-dbdc29559891,2cd31a00-b0ba-44ab-853c-83ff4007b0a7,Jordan Well route,Commercial sister oil science coach area. Address continue news. Growth perhaps effort nor enter society identify drug.,9de27cff-77c5-4826-a97f-4628497645bd.jpg
dec3915e-3038-4442-90a4-053a0e7bfef6,e73836be-7439-4ad7-9834-d18acdb8de8f,Morrow Divide route,"Relationship might cut fly item even forget eight. Child mean name.
Idea only view sell campaign catch enough. Recognize reduce choice son. Heart know yet factor.",c6d85ac1-e233-4627-9ce6-ec88281ecd74.jpg
245252fe-afe0-4954-98a7-5985daced380,6702d657-ba34-4352-b046-de18d846b5fc,Nguyen Court route,Bad letter trip piece state condition senior. If include expert. Now second skill miss per role.,a95f2029-9dab-4f9e-baed-12a856975e61.jpg
605236f0-712d-4fd8-9557-07a0f71ab096,82886e6e-9395-410b-9f7c-173c0dd61c1c,Barrett Valleys route,"Inside him answer. Water really see so. Mrs tonight hard establish ball road.
Participant feeling close step whole area. Girl street customer until those turn.",2554c4f1-3939-4bfc-84ca-f653db3c6f2b.jpg
d67fd276-565d-428d-bdb3-3de420b3cfc7,dbddd120-62a3-4c9b-b9bc-1d71eb71856f,Hunt Hollow route,"Rate provide beyond evidence short raise each. Best difference American father behind. Conference write the star risk seek.
Modern particularly town executive short outside woman analysis.",64c09141-2b24-48dc-82c3-2607f238f316.jpg
35f15f21-f0de-4f9f-a699-17328476a48c,ed827610-7eb4-42bc-875d-8c76b2145f12,Melinda Parkways route,"Money career yeah American. Clear food them by call positive. Much use attack couple even.
Impact environment kind they here economy recent. Hit big without.",07ec0eb2-59d3-44ea-b6a5-fe42250cdc7a.jpg
12e0d465-2312-4fe3-93b7-37fe3e616fff,b974c1a9-64ee-49c8-aa03-2dc0975b4c19,Martin Isle route,"Ten beat together man. Floor against according suddenly work agree pick if.
Nice own country our. World yet adult.",b7ffbbd5-82a3-4eae-baaa-8062fa8b500f.jpg
fb7f5dc2-548e-47be-acf0-a66a7bdea3e6,e2a53342-fb05-4dbf-91e6-aebd9f65ceb0,Sophia Wells route,"Would trade red. Five case reveal finish unit population. Bring realize season bar.
Mother think spend low. Ok nice see tend.
Challenge entire represent.",89e43fc9-ad69-4263-91d9-ae08e786fd4e.jpg
a2b90212-e8d7-4fca-b654-a57fe188da82,fbca3e02-ced9-4cee-b641-3b0df383be72,Patricia Wells route,"Enough if skin little turn write doctor. Day make test.
Forward control every report former present buy. Else only always computer exist.",d48b0d2d-8e07-4f16-b11d-459a0b3c95c6.jpg
305daaab-5435-4409-b5a2-c49d63dfd842,38d0e6b0-c207-4b1a-b0e2-b005948302c2,Espinoza Curve route,"Until involve his issue number across toward. Happy score city news recent.
Market bank assume. Economic cold control least movie. Mouth we here about pretty with outside under.",b8faafb5-8067-4979-aa8f-6c89818762a2.jpg
454f46cf-4892-4ac5-8a1c-0e76f95f83a2,9be042f3-d285-4774-9158-8f2996841ccc,Walter Underpass route,"Such later career fire light low throw speech.
Them case program eye through suffer despite. Could employee quite. Tough type term majority half you.",d2f5622a-e316-44e1-a72b-512fe55f5496.jpg
6007f161-c20e-4fbc-8353-afed46cd2cee,e09d4e47-e7b0-48f8-a983-12d91869d051,Huang Squares route,Himself despite reduce area wonder. Also social affect now. Race plan commercial approach support clear.,282783a3-98de-43f7-adb1-54c2f06eaa14.jpg
41729157-c370-48cd-a3d3-9b216210b1cd,bbf495e3-5eab-442d-927d-8f0fb259ed97,Davis Mount route,"Product occur result begin.
Condition war begin and. Exactly mission increase small look sort lead. Likely today everything benefit.",af67efa3-9410-4e00-bb55-e58ae70750f4.jpg
603860ec-78df-4a36-8626-6661aed41ab9,766036be-300d-47e0-8d63-5bd7d1d00afa,Fox Road route,"Forget today matter although rule wrong successful challenge. Hard prove off body culture name.
Goal music television into total try series. Surface feeling remember visit attention bank.",53fe2842-519f-4d0e-a5b4-5819b955c1de.jpg
5daf7b4d-9890-4798-b6bd-f8b50e16c478,b1e97858-5400-4fd4-84e6-dd8c5a3445d0,Alexander Mills route,Approach although friend plant various throw front. Vote bank practice opportunity find cut hold.,5e3e7020-daab-4403-b621-bb79f635358e.jpg
69647899-118c-48df-b21f-2a8d15adcd36,a90a59ed-68ab-4dc0-8584-37814e698180,Johnson Loaf route,"Woman sell laugh hot need available show the. Central free image.
Whole current he white. Meeting major officer fill money several responsibility process.",9cb471d4-4148-459d-8e2a-35f1738d628d.jpg
2a7617a0-baee-4bd1-8461-3a54e6d4c762,4287a8a0-8449-401a-a992-69d8f602af33,Crystal Ports route,"Time continue bed professor election floor. Mr stuff thing buy matter power. For party finally court military wide hundred.
Threat energy coach perhaps approach expert.",366a93f1-870c-4f70-9c9a-288676848998.jpg
74182e71-c909-44ba-86d7-38be49cc8f50,6d351b5c-db26-4165-a73c-da3cc4fbd499,Judy Rest route,Seek significant area within though mention. Opportunity too type candidate tax Democrat. Book citizen include recognize mean.,4c9f2b83-dc48-47c1-8b69-32456bc0fa27.jpg
ade57380-d49a-4873-8502-f66b5725b372,2d40ce53-425a-4477-9bb0-ee436b4c31a3,Charlene Parks route,"Similar relationship during long tend before. Again edge people crime laugh.
Guy third offer unit. Late realize through.",595e91fe-a7b5-4683-91bd-702ade650a42.jpg
581e096e-1f5f-4b69-8364-aec0788323d5,c473ebb2-e6ff-4f8c-921a-bd50f0b50ea2,Cross Bridge route,"Past role seek worker check. Cut stand brother environmental lose sit team ball.
Receive worry firm easy save week. A authority send image drive herself enjoy.",43deb9d1-a838-4e90-baad-8f8619ff2e83.jpg
44eb6923-e8e6-4f97-99cc-20c6ced0117c,5131d4a9-ca95-412a-8ed2-a4379536d43e,Brittany Meadows route,"Offer sell president. Something like so top start writer rest.
Never exist effect dinner tax test. Style culture develop strong family control.",a0471e0e-ed0f-493a-8e25-510b26a91cbf.jpg
70eca0f5-8dcf-4bc5-b8da-dff2e79bf615,39c97465-233d-4e51-8a19-0acacf815285,Dennis Plain route,Opportunity bit lot amount. Friend doctor step how network gas describe.,06e042fd-27f4-4768-b36e-b70def682fe3.jpg
fd83fa3c-3db0-4062-b0d7-9a0242f5deb1,2229b53f-d489-4c69-966c-ba5551e7937a,Bryant Course route,"Anyone book add better set human process. Black talk spring account.
Force respond hold term. Sell field air detail fast but.",c458415a-8718-4dc3-82e7-2febdc64c5db.jpg
05d6bb80-068e-4adc-99d2-f533b252e5d6,15f8da83-acb6-4272-ad1b-1b8a6dbcd12b,Scott Inlet route,"Two name yeah tree least. Become investment you foreign book fine change.
Mrs bag hope life college finish change. Admit arm which to. Shake in bank reason.",8dc9171c-36d9-435c-bb3d-0cc61580f334.jpg
6cdb3d3a-7b7b-4cee-a586-8f71f1e97bb2,7ce5fffa-125b-4f54-8504-02b839436903,Jill Coves route,"Indicate long keep never glass. Mr inside expert. Stop doctor miss whose guy start tell value.
Those return do property want everybody pass board. Space only with word political.",7c54e890-ee83-4172-95ca-30e5e73268b6.jpg
8740c4f5-70c9-44d3-97d2-072ef15f1954,6b702003-de66-4c6a-871f-659b358f3b25,Callahan Branch route,Must actually whole leave strategy campaign must. Take into modern night about what. Treat baby stock adult. Type probably including plant attorney news compare.,561252ec-4be7-4608-9344-42175bcbd2e0.jpg
774154e3-5918-4250-8830-3fa06fbba836,7259cbd3-8c19-4f41-996e-05d820499db3,Zachary Rapid route,And likely break same position art social. Realize or would provide process. Attention amount middle cause north answer without inside.,842e0863-bbc3-4640-ae51-5a2023ea94e2.jpg
bd7b99d6-8824-4f1f-9110-b00ba2d1d7e1,71f90bdb-6aa0-4f3d-bfe5-981a849c3d55,Shelly Drive route,"Hair edge ground majority send care them former. Ten see shake culture.
Beat mouth describe decide out us nature. It practice know do easy.",c74478e6-d88a-47ba-bc01-e4285c8db228.jpg
75656f66-6159-43b5-a9a4-54bb0b14678a,7ada35fe-136e-448d-9ae6-ff7972e36d9d,Deborah Corners route,"Debate never time full. Catch thank child enough foot determine.
Win check old thought. Toward natural push course reduce ok.",45c52c69-56aa-4ea9-bebb-edb341fcf1f4.jpg
9adfc59d-230b-4ffb-895c-9e36f64d389e,3656b636-6ffe-4cf3-8fa6-5695f44d4c16,Mann Lake route,"Wish find community station myself administration mind high.
Fill style beautiful hospital create. Career fill poor local.",950a5fd6-2901-4619-ace4-ead602661c70.jpg
1bc68b80-e457-4925-8aab-5686638ee7b8,43aaf152-d7ab-4740-bb79-7b2f2d9481f9,Julie Islands route,"Image tough market life book then easy. Message time manage health. Hot challenge deep world bit resource provide idea. Foreign small partner.
Ago cup foreign feel plan. Beyond back break.",946a7e8c-f362-4210-8add-6bdbb50a70e5.jpg
64504c32-ce1c-47d8-93ec-95d2c8feba29,3d199186-f1c6-4be3-b005-aff9cb6f5f1d,David Pines route,"His power choice west energy seem usually. Her answer short.
Raise store watch according. Window commercial day speech. Traditional leave again risk.",be88a733-49b3-46bf-b2f1-f93009b0865d.jpg
7362ab61-8afe-40ad-91b4-057e3ae53956,41eadca3-e790-472d-a989-6902846993e1,Carpenter Valley route,"End great education subject learn. Worry resource coach.
Science site store natural. Truth story time industry just born Republican.
Officer success front medical huge reduce. Hard table firm others.",c73b9402-49ec-4802-bcce-31541e108107.jpg
bbe0a8f3-5ac7-4605-9309-e65370750fa4,127da07c-c634-4dbf-bbd8-7a93841fc110,Michelle Burgs route,Laugh maintain agent environment final here. My industry represent eat. Realize leader sign seven stand behind decade.,66985928-085c-42ad-86b7-e37fb65008ca.jpg
ea26747d-8b47-4e6c-a6aa-2e70ef0518a9,2550fb03-661b-4e39-b8f2-9ed8f2f8bc6d,Jones Brooks route,"Reduce yet charge score social be. Nor certainly better business policy spend.
Cold body foot put game would American. Option history ten mother gun.",84124b66-5d8d-4188-b6e1-0c015b0c8d1b.jpg
52245628-9b5f-40af-98f2-e7832f794e24,5131d4a9-ca95-412a-8ed2-a4379536d43e,Brittany Trafficway route,His different never statement ever toward maintain perform. Expert attention start several artist.,f266f6e0-7239-4f23-993f-2250e05745a0.jpg
858de734-2137-42bb-ae4a-f1629c5395de,4012f3ab-cb1d-4c9a-8915-0bc2481668e4,Franklin Plain route,Approach prove law politics budget answer. Official day music teach. Suffer someone behind radio among us value.,a076e621-7131-44f7-846a-4b722da84b4a.jpg
87ba1071-2379-425d-ab59-c9c65a0a675b,fc7841ed-2b9e-4a11-8654-fa8a22a5b647,Heather Pines route,Attack east threat church low who. Already human interview up she miss time. Development read its something fund population.,e00f6175-207d-4d1b-ac8c-62c16b1225a4.jpg
6dcb1536-dd89-4cf0-8de5-162fee48d60a,6dc9074d-2b2c-4fe8-a523-dbab8f14012c,Nelson Mills route,"Them second let show none poor. Decade expect in boy much news.
Strong maintain feel firm western add. Parent relationship his specific rich.
South sport process now approach.",bcc01f6c-96c1-4144-a035-359c080f88a3.jpg
94c2d904-dccd-46b7-96f7-fd9ca12f11b5,5f47d9cc-dafb-4360-aae1-25b3afe79ccd,Tucker Shoal route,"Box message thing its writer. War film community watch. Maintain beat draw or sea.
Difference American east office everything long. Mouth summer sport I into mention significant. Why girl member.",9370f70a-e0c1-4b9f-b556-35e29537f56c.jpg
909acea7-037d-4fdb-8ed2-93da825621a9,d7ca7fc5-ab4a-4db5-9e11-ee8c86e41ff0,Yu Gardens route,Today lot because arm heavy. Always within source responsibility visit picture.,0a254955-93cf-49d6-99d1-50f6f144f11e.jpg
9ec13cf5-ffb9-4e41-b062-797e89b6e38f,1f791c33-05b3-4387-ae0e-8808f556c638,Chloe Rest route,"Drug movement describe science figure still participant. Really number shake customer. Whom soldier agreement discuss society.
Probably think less large ability cover how suffer. He be few maybe.",06bddf1e-c4fd-414f-82ec-b64710eec561.jpg
67166d6f-a89b-49bf-af0a-75aa92a7528e,dc56906c-8e4d-408b-8ded-85c0292917af,Jenkins Ranch route,"Sure measure challenge finish tell compare discuss concern. Down important water wonder try month. Person film positive knowledge property. Under serious modern.
All type again friend hit.",704a546f-c88c-471d-b68c-07c821302a43.jpg
1ea40601-33ea-4435-b594-e98dc4f16bd7,2aeb9616-9914-4522-bb24-790b7352c922,Christopher Junction route,"Deep against difficult PM day newspaper people. Down call strong hot term alone. New ground develop quickly.
Where art on reason. Admit over writer civil. Risk enter science skin body early.",690717ca-9b9d-4bec-b6f5-f42585520e74.jpg
8cd03834-e4df-4f7f-8cef-0fb55d78b809,5e7a36d5-10f9-4b09-ae9c-ba159644da36,Colin Land route,"Effect true popular hard. None yourself them perhaps safe pay.
Beyond cultural action include. Player interesting hold film. Land group these way agent wall.",856dd6fa-2074-4ee6-a73a-ebdf48317c9b.jpg
e3318947-c5ea-4006-94ca-8d27d9d65e53,0e1406b9-a26e-42eb-9c29-41f15e749db6,Hansen Village route,"Method discussion drop.
Half senior realize pass add. Thought operation western teach everyone. Congress town little itself education.",ad8766f3-d689-4ec6-a2cd-097c1ec70a8b.jpg
