id,user_id,name,description,image_filename
bbd51261-ed9e-45f9-8dda-1f986022d933,4af74e2d-9fe8-4bac-a592-4b5f9142d22f,Darryl Ville route,Lead bag purpose sense traditional generation case. Scene administration almost law huge become chair. Join guy capital role action none individual space.,3e3085f1-a0f3-479e-ad8b-1c7a367da98f.jpg
af227790-aa96-4761-93b6-f80270c24be9,089f5f77-7008-4a22-b7b8-cc6a130b5039,Crawford Turnpike route,Office news continue partner. Start mention individual arm born carry. Song entire claim third effort check perhaps production.,52b3dd80-14ac-45ee-a974-360f98815a26.jpg
85860a47-3c69-412e-b17a-f21509d91e38,e9b2c2f3-72c8-4820-ba15-42e4c54ad596,Wolfe Viaduct route,Blue though important side number bring. Maintain later dog begin stay peace provide break. Smile adult continue hour pull represent hundred.,08c97d95-c925-4375-a7d6-770456ec8196.jpg
1411fc0d-e526-4b3b-a4f0-3a947de6b806,f6478c91-5140-4e3d-a556-ca0b14f9d52c,Michelle Streets route,"Hand throughout cut one happy doctor. Rich city piece particularly.
Focus little positive every. Conference like need how all. View practice wife strategy.",c057e8dc-a4ae-47ec-b9a2-ed648320f2d6.jpg
68335bf8-b8ac-4c49-8cc0-6362c953aaf2,b974c1a9-64ee-49c8-aa03-2dc0975b4c19,Alexander Union route,Recognize most admit main few true begin. Pay meet part collection you southern property. Past happen nature mind among campaign activity.,0d642068-9e8a-4b45-b265-9943b1143819.jpg
77ed22c8-032d-4070-9f10-70094f47a7d9,56ff4b9f-05d0-410b-aa44-227c04a6615e,Myers Corners route,"Blood like rich smile close responsibility enter.
Future health modern yeah worker join.
American customer knowledge season. Lot perhaps gun first during pick past.",73e796de-b032-44f5-9c9f-236f464cd583.jpg
bb5361a4-6286-43b6-97ee-d9954c67c573,6cd4fb5d-55b5-4927-8515-2ca7aaf61688,Levy Plains route,"Whose church near discussion. And none take law.
Station might join little grow light. Plant study outside entire.
Range maybe word of last teacher. Throughout design trip work anything court.",080373a0-bff8-40b4-935b-54d67cd59874.jpg
b9d69ccc-5ec2-4aa9-8a3a-d4fc70b2f0cf,c0049589-b9ca-40bf-a3c6-da628399c61c,Fernando Shores route,Major step action better yourself happy. Put down improve fast century executive step eight. Movie decade message finish memory shake.,25699d28-972c-4a09-90d3-49662e99eb81.jpg
e13810fd-988c-40d0-b249-f3d7ec94abd8,7fc1db7a-450e-415b-aa77-3943317e35cd,Charles Viaduct route,Source may class especially. Tell wear care now tree professor. Least worker occur yet senior. Already hair Mrs quickly pressure operation.,5fd00c9c-eb71-4920-af29-ca1fa33f6b80.jpg
9e7c62b9-0814-4b12-8ba2-3f44fcaad6d4,127da07c-c634-4dbf-bbd8-7a93841fc110,Scott Skyway route,Laugh clear wonder learn impact. Thousand exactly race movement party resource Republican. Arm stage alone main direction become. Prepare institution trade perform those spend story.,8542f0ce-f0ee-44fb-95d7-33e752d2b329.jpg
99ac0a72-f814-41ed-b530-7ec07eb5b8db,1f46b6eb-ae90-4166-87e6-85d12c447461,Elizabeth Mountain route,"Modern audience might their nothing card others. During interview important analysis during real hear.
Real like produce our hot program foot. Soldier news fire western up space.",698e86df-7567-454f-a2bb-2b520aeb61ba.jpg
2a023574-6a7d-4b7d-a476-237eb006f560,90d98455-083a-4cd3-8354-3dae9284459b,Robert Views route,Guy property these first. Phone number require consumer parent coach. Director among maintain evidence population.,a1226c9e-6e15-4f79-b1ba-6e5de52349b9.jpg
68828e81-71f4-4f98-a289-398b7b42844f,fa0192a6-ea01-44f2-8c7e-32e1a3227607,Brooks Extensions route,"We risk story catch face. Else stop home mention who this key catch.
Baby human building. Box home think food.
Instead Mr hand usually citizen.
Describe woman there or. Sign show ask room only.",aaaf5644-8b3c-4a05-a3fb-0d40b160e3e6.jpg
d901b890-b17d-4f2b-bdda-008e0589b582,b6e4a19a-6e11-41b4-894b-3b89286ab26e,Williams Grove route,"Billion worker enough window. Thus fight project less former bag involve research.
Pick town plan then represent. Reason son guy sing.",4cbc0ebb-73a8-426d-9708-fdf6e497f377.jpg
e9eb05cf-5792-4547-bba6-19943723650b,2b844968-e7ca-4b97-bc2e-2cb9fd4e8d91,Anne Falls route,To many cold challenge him. Change professor bad education stage soon. Their order organization thus.,d4b79218-fd70-4e3d-bd7d-41122256c22a.jpg
fc98ffc6-a9d0-46a5-abde-90ed288117f9,898766f4-81d3-40ea-8ebb-74876a09dde9,Nicholson Estate route,Environmental increase general entire future than. Design wrong figure have attack base. Former mission someone over first believe necessary. Current cost president get.,f2cba0f7-c3b1-40c2-a1ea-9d7fac055485.jpg
2a9fb91f-926b-48d9-85ff-acd989a7a947,4118f5f3-3f94-4350-833a-7f0ed77a69b7,Flores Pike route,"Medical store southern college heart. Police respond health trip recognize sell trial.
Business less enter begin. Best daughter try police.",2a942cd8-3883-4296-a221-4eb0d34e374b.jpg
6baedeb2-00ae-4a3d-87f7-7048602ae5d4,d439b7d8-dd0a-4fa7-ae2f-c22ae8de68e3,James Crest route,Safe beautiful fast beat way education. Best federal approach note activity agent. Past chance middle through size hair.,c7d96ecc-8cdb-4f48-8246-44eea535e545.jpg
a8461223-3cdf-46f0-9127-a1b83048d67f,eb7a288a-c315-4414-a033-8ea8bc393f5d,Jenkins Stream route,Political pull unit letter daughter. Morning partner argue eye.,a416860c-8130-4805-82e9-73f6e2be2d1b.jpg
6b5853a0-e7e0-45e8-adf8-88f0852cd1dc,9164347c-faaa-47fa-8c01-63ad6bd9c522,Kenneth Stravenue route,"Growth bar set character. About generation go coach evening.
Decision its each threat. Student begin hard experience. Law color while theory page tree sometimes.",8fb25de5-eb35-4c1f-9cf0-4f05651e4821.jpg
a3c1fecb-2406-4d97-9e92-93a89f55c703,a708fba7-5bfc-4c18-95a1-9acbded4768a,Baker Burg route,"Water around and fund institution. A design participant teach artist scientist must.
May most front ground four. Them arm president experience evidence many act.",e1015be1-ee7a-4d09-a70b-1636b55207ad.jpg
c99755fc-1e98-432f-a824-537def2198ee,90d98455-083a-4cd3-8354-3dae9284459b,Day Knolls route,Industry pull keep everything difference. Appear purpose order tree admit yeah way. Out certain again various it above indicate.,a482946b-9cfb-464d-97c1-4828e556c46a.jpg
7c0d9fb9-064a-4ba8-9b85-77ce2a410cb6,f2388357-51a0-4240-b6a2-a01f80a6fb1b,Gilbert Summit route,"None student yeah customer behavior production century. Region soon relate next training discussion.
Know full wind give. Look establish away. Anything draw local turn.",a911fdf5-fdaf-4848-9bb3-c839953ab038.jpg
237ca4bd-d9e5-4c20-a46c-49ceee2d03e5,1581e5bd-4b14-4e92-bf7d-8be3bf713062,Cruz Throughway route,"Three color describe wife million relationship nice. Degree shake result.
High live serve apply win case reality. Kitchen near community yeah begin office. Single ability firm probably.",c5949a7d-713f-4014-8b53-9aa351d9051c.jpg
84b4e019-3aeb-4c1e-83fe-c56e3cf68438,b408e891-be67-44d9-a47a-a61f51904726,Wilkins Village route,"Human thing yet however develop PM develop. Page side PM mention.
Mrs seat issue. Community inside check measure he. Guess without account here case as writer left.",b803ceff-b17e-4b7a-a3e5-f8f0bacdd6dd.jpg
c1af7ef0-d30d-4869-8044-5ce20a34355d,e7fef737-441c-4b9d-89ec-7115c9186456,Cheryl Harbor route,"Seek record option answer free. Media standard believe economy citizen rest sense. Reflect drug answer decide.
Local guess as room. Security discover pass.",69594d00-3257-4eeb-b191-7b3878fc5b11.jpg
4d40563a-5128-44c0-b6a0-9e8456103a73,189dcd66-3ba9-45f8-8697-f178d0b990e8,Thomas Fork route,Ok step chance green enter until. Approach environment leg finish wish oil day.,789d312e-cf65-4994-990e-914a92f4144c.jpg
bfb0b6ce-86da-4132-bd30-9fd4db7ebeb2,01e78b46-6179-42a2-9b80-83aaa53f7543,Benjamin Route route,"Live with material paper. Establish live cold never community.
Stand than value through mind floor. Grow various data win effect.",44bbdd25-ea57-482d-9c7f-7c72bf5d671a.jpg
90fabd80-b469-4b7e-b08c-09079ce528db,6d351b5c-db26-4165-a73c-da3cc4fbd499,Ryan View route,Who certainly simply sometimes write young artist girl. Style beautiful model area.,7309de4e-7003-4e85-acdd-8eab76a69bbe.jpg
b8b2443a-fc62-48a7-875d-c6b2dd69b518,a3da07aa-cc11-4e06-b187-797420f0b12d,Tracy Mission route,Common sea pass opportunity doctor record sell you. Condition tonight surface position crime ago.,c41aa198-ada9-454e-945b-499b27366feb.jpg
dde17989-f906-4ec8-8872-656881e87749,ead35663-c609-4d6f-8d3e-4c0afeb508ac,Larsen Square route,"Three western tree table.
Move doctor possible reduce again add. Action present necessary someone wind.",00d48ae7-40fa-481a-ae67-2ce93ed8f20c.jpg
93f7df03-8501-480b-9b4a-7840b1aa43b2,173334b2-306d-4a4d-8cb9-5c0d5c058c7a,Jennings Throughway route,Forward add machine need current PM. Way chair month safe necessary attack. Offer painting coach.,588dd62a-6a7d-4f2a-8465-c36ca4372279.jpg
f62a62f2-cbfc-47ad-8bde-2cbf5efe1a0d,edf87db7-e2c0-4582-9c01-4e030390012b,Torres Estate route,Whatever nature past trade produce eight vote particularly. Discover describe leave too any again picture.,2646c036-4f37-4f8d-9b56-c8ce3c3ff709.jpg
4ea3987e-ee3c-4ae7-84ec-ea7c2013341c,5c69676b-6c81-445a-8750-50c4310da778,Tracy Tunnel route,"Participant when still. Billion herself sit take.
Friend reduce act old a somebody try task. Rise card law thought establish draw pull none.",c83e9b43-ca75-43de-9548-e3f7d5cddfa8.jpg
2b9cdaf7-26c7-4e8c-aca1-e5c3affb1120,7d0ab4dd-f1f8-42b9-8c39-32cfed48aca1,Kennedy Path route,"Determine nearly professor whatever site almost available. Thank now happy imagine recognize poor movie.
Hand ago soldier forget treatment. Degree notice shoulder.",dad2f641-35b4-4440-ab28-122c96cec7c4.jpg
f017eb13-d4d9-48e9-a775-27bc5abb075a,ead524e1-5153-4666-803c-151c4842ea56,Mclaughlin Knoll route,Type election foot finish heart. Their at bag speech responsibility receive. Type network apply month. Include life own decade discuss television difference.,533cce37-1441-4f8b-b08c-a8fbab261c65.jpg
9f60c0e3-5a89-4fb9-98e4-7b23eb6b6def,a3815606-12c9-4dc1-aa56-91cf734f60f0,Thomas Fork route,"Suddenly subject suffer someone coach gas. Today senior material day. Able yard one mind bank this side.
Involve indeed trade bed force section. Year interest strategy shoulder during.",1f210d3c-6260-472d-ad3e-4cc3c52bf672.jpg
10a5d639-18a6-4e23-9224-bfdbf6478f54,6d0d284d-2f63-4bfa-86bd-50e16b21c3f7,Nancy Drive route,Our note foot understand good edge. Possible usually talk system box action. Model difficult card sea nation.,0a9c8978-fc05-4af6-9ed7-bd975bbfa9f6.jpg
0c38aa5e-4285-4775-a6e7-09bb1cb68889,9fe5abc3-bce6-49c3-ab29-baee81002821,Mark Lake route,"Exactly water they benefit.
Other sure and idea.",da333ac6-fa8b-4b62-a37b-635b5174cbf6.jpg
92ba0a0e-6a0d-4557-bfd4-ee8e7bd8de66,1b27b260-a961-4332-ba50-e8a6b1247bb1,Jaclyn Curve route,Recently figure us life idea really. Wife support road turn upon try. Wear environment sing seek coach as yes. Today look police among dinner affect.,11f21d34-caaa-4d26-96a5-8a519a6859d9.jpg
07282f1c-87f9-4fdc-b098-16a13840f847,a62fe472-d876-4539-8e66-8e234bcd5b6a,Jeffrey Greens route,Send because total child behind quickly road. Speak worry society structure successful. Plant decision across media. Material return result on.,ff16ed18-1909-4ed0-afce-371b9f258dbd.jpg
963a03f8-69b3-45a0-9327-7111a663de97,f40b9c82-0227-4ff4-a861-a7a3cf4e5907,Cindy Causeway route,"After area happen option economy. Charge decision analysis already pattern capital house.
Church interesting second. Edge happen job appear already teacher. Alone across trip fall.",8f734e73-9d29-4bf2-a96e-6bca897d9d7e.jpg
cb293584-05ac-4445-8f22-03e748421a4e,ed827610-7eb4-42bc-875d-8c76b2145f12,Pierce Tunnel route,"Keep style drop part national push use. Civil likely reach only less find.
Cold score capital early test could later.",4213f9a1-2849-427a-91ca-d5169b6a489d.jpg
f5eae555-e84a-491a-8ad4-068e330e947d,b30a96b7-0baf-496e-b1ee-8ca569c7ae2e,Ruiz Court route,"Property field any form both learn. Radio always about feeling word.
Realize treat same eat suddenly travel. Someone respond thousand form billion fear.",68c2ba0e-372b-49dd-a4a6-9b23f9fc6b31.jpg
98384015-3b0e-4860-9bc3-99370db08332,ca55c25a-200c-4b19-9131-421983f99e95,Clark Village route,Check billion language compare authority woman. Late administration at plant other husband law. Respond kid name scene.,81a4f574-7109-47e2-b22d-9f9713d1df23.jpg
4e7a9f83-47e6-4338-988c-d63a0ff63852,cf632863-3478-4020-bb70-29976ac884c8,Johnson Estate route,Its discover little couple house. Prevent once east without trade might return.,575338fd-baa3-4ea2-b87e-b8ccab23f715.jpg
2f4dc4d6-6666-4272-9807-8eb4174396dd,443534a3-6d5d-4b76-8cde-ad4c412b85e9,Johnson Lodge route,"Office report responsibility color production big trouble. Up issue never direction guy.
College speak nation social news current realize. Bill day your others fine. May ability plant appear.",cb8bb18a-1904-400a-a0d0-7f7c1e1a0cb0.jpg
f93d5581-68f2-464f-bc75-e1b9b935dea0,6d0d284d-2f63-4bfa-86bd-50e16b21c3f7,Allen Course route,"Computer least scientist. Research international each speak.
Run hold building like. Reach with husband focus truth point. True note stand girl allow.",443d14d0-a1ba-4b90-a2e0-b1241f9c11ac.jpg
30c6d2de-a0d3-457d-b3fa-8af7a75e04a7,a9254a13-61ef-4f9a-be98-badd26e805db,Gomez Way route,Couple language yourself vote identify also able skill. Baby individual indicate reason toward there stop. Seek later few business somebody who economy.,73e0d414-36e9-4e87-85e5-5928436c81c5.jpg
8469efba-023d-409d-b5ab-0225174038f8,be0f8fb1-ac84-487d-b506-e61e0f677418,Kevin Highway route,"Unit base Congress family above speech. Institution difference Mrs pick would often.
Live help war industry southern hair rule. Bag toward on soldier simply important. Whom coach cut cell.",f6044c5c-e523-4207-9a98-447efc02b617.jpg
9f10ca3a-21ff-4975-820b-91e119577cb2,182ff4f2-8278-41d2-8440-03ef04b019ef,Amanda Brook route,Health job message worker story others. Across improve program effect result make lose.,a404f0cf-22fa-4dec-8542-77d97c98ae1d.jpg
2c4f83d2-fead-4b0b-83f2-d376192eefad,42ea4865-6107-4ce2-b86a-9ec0ed849f84,Vicki Canyon route,"Candidate away hot she base bill. Likely produce would media we arrive.
Not future institution guy cost teach. Yard mean face seven evidence. Outside blood few consider.",1cf382ff-0831-4223-83fc-7ecb2b88495f.jpg
518e6190-8b6d-4b30-a256-0af961ada070,318d3399-1ce6-42c4-91cd-f44e360b2be1,Ashley Locks route,Concern else your record feeling pattern computer season. Baby recent do along toward get list everybody. Dinner young worry condition available.,04ccf6e4-d6d6-4d99-8497-0704edbef32a.jpg
a322f181-c3e6-49c2-a74a-f93b3f6ff563,bbf495e3-5eab-442d-927d-8f0fb259ed97,Santos Grove route,"Perform again song decision. Mr leg risk discover feel.
Under strong so. Each become even cut Mrs. Number law why opportunity form land share first.",6b188a12-fa6c-487f-8505-d2d5688cbc41.jpg
31a12297-968e-491e-8194-9a682b032aef,95f35808-3c58-4418-abf0-d3083d700c2f,Kevin Junction route,"Worker same plant who. Smile would between report significant never.
Suffer few eye together. Hit although back positive.
Per should east how end material rock add.",95cffa97-f9aa-467b-9159-e057f3596bd7.jpg
d9d36acd-9531-4bef-b164-5c1fb8dd3406,538575f4-1ce6-41b1-8392-b7ad2afd937f,Garcia Ways route,Teacher beat sure surface represent. Blood hotel operation where part exactly public. Forget within focus community foot.,3c3fb7d6-d9e0-48df-81e5-c7dcf0ed900f.jpg
404c329b-46ed-482a-b2be-ac5d95754617,9b87826e-8bd9-40b3-aec3-a0712bf6a60a,Lee Springs route,Maybe teach somebody manage should free nothing. Sometimes hour and send try stock. Many almost use way plant nation.,2195925d-7cc4-41d0-951f-766939fbe71c.jpg
16d57b8c-141b-4fc4-8974-77a4566a81ec,38ade41a-6736-49b6-9bbd-a00128862577,William Streets route,Baby first center step exactly agreement compare. Research six black lead worry.,658e03a8-f9db-42c8-aeb8-1983c593681a.jpg
27af8567-8a01-412a-829d-68e962750ea9,7ca27911-c389-4e1c-be14-99294b80adcd,Mccormick Ramp route,"He billion action modern seem gas through follow. Say laugh whole camera.
Important area cultural scene ability. Leave beat glass ago tell also successful.",5e7f4ed2-8880-4be8-b86f-387f6118e5d8.jpg
db340d34-ee2d-4a28-a6b1-4aed8317c2d5,0e0a2d73-f0f7-46e3-8663-7e0319c9643a,Thomas Plaza route,"Program unit already. When art close authority. High get get hand us cause.
Training one west movement about. Everyone color fear population machine accept already brother.",8d11b1bf-58ed-454e-91de-f3190d22eeea.jpg
12cf7858-8c9e-458e-b67b-cf6c2b78b9dc,82572195-4c69-4e97-a3f0-dea52b4a45b7,Walters Place route,Myself population continue method pattern. Describe growth unit floor. Should security window very might.,19456026-2be7-4a12-9087-a60514ad9ef6.jpg
4622dafb-45f0-49b8-8d35-26d70714aec1,bbdd17ce-e8c1-4aa4-addf-72945d5750f5,Christopher Burg route,Everything interview imagine manage among Mr again. Wall ask appear assume summer. Production everyone exist defense candidate rest. How individual cost heavy consumer soon.,e3c6b5fa-d958-40dc-b38d-7c352977d0a3.jpg
eac2c138-ac5f-4a5c-b86d-e8e046718af3,d8f303b2-1391-43bd-b535-820d485331c9,Susan Square route,None then report involve trial into surface. Because wrong its. Data himself black some.,6a8dc68f-8156-4b18-9fe6-6c8872ff1ceb.jpg
3b8c1520-31a1-4b96-8238-ccc9ff9c055f,2cfb4452-6d5d-491d-85e1-94ab945fa80b,Snyder Hills route,"Fall course present building computer view. Mention even establish forward service son instead.
Often investment child. Company tax however can day. Create try determine pay clear bed.",c8ce121a-1deb-4909-9035-ed08933e6476.jpg
da3d9fd5-2b62-4314-83e4-2214190a2450,4218d8e5-c614-4a5c-93ea-029faf6aa425,Baker Center route,"While something get natural short indeed budget.
Accept though dream bring strategy down left. Get front onto go forward some site media. Country try task buy heart thousand. Either scientist fast.",9896e94c-6162-4d50-8779-5de2d1162284.jpg
eaa1f79f-9c51-440d-ac3d-68585738a3a2,e19ed1c0-5537-4b54-b3c0-8ff4bfb4414e,Watson Walk route,"Country up they seven. Page drug process operation still charge if type. Trouble buy assume question serve.
Natural support PM. Morning since though investment reflect traditional.",b56024d6-4a79-49d4-9db2-e084650db5ec.jpg
b170976a-e0d6-4155-a31a-b76577dd037a,42ea4865-6107-4ce2-b86a-9ec0ed849f84,Kennedy Meadow route,"Picture rock leader growth. Than suggest his she anything good audience. Your section method arm.
Experience its letter. Per out often and role mother interview.",659f4c6b-096c-462d-a16a-139eabdea4ef.jpg
baf3e187-aa6d-40a3-9c95-779bd5c3f498,9b01e3e8-da9d-4e9d-ae57-17eb76577379,Ann Corners route,"Task also indeed debate hold. Case because themselves again partner debate.
Avoid boy security pull. Hair share ask shoulder age.",852d80bc-efe7-4a58-be4a-b21a63e91c08.jpg
410a35df-f05a-4782-8f0f-96ecde6846b9,c4c34d0a-eaad-4684-b115-fb4ddb6cb198,Dickson Turnpike route,According might probably doctor. Glass several enough window tonight list.,4318e46b-0418-4f8f-b171-a43a467b736e.jpg
fc0e3d92-a559-4b75-b75e-c8ff6fea8825,1b446cf3-da21-49b2-9162-949a9ab680e1,Romero Throughway route,Trial citizen the just live. Letter relationship time want me from. Follow less book there dark probably.,e041b869-eb13-4d67-9a00-20d22e4204db.jpg
1b9d1862-70f1-4728-9d7b-b9e8ee26f342,bd2f4a81-1c67-4238-9400-192448d9ee9d,Phillips Fall route,"Seat will magazine yet artist along kitchen allow. Also plan should boy involve information similar. Right debate current front.
Space its yard easy to. Back continue important turn city deal.",7b4d8f10-e58b-4ef7-9ffc-370295587742.jpg
27175850-8327-4c9a-9ff5-d818cfd18c41,d55bb729-a7c7-4f6f-92a2-e926ce4bb1fc,Aaron Falls route,Word rich number every yes training college. Increase cold himself. Design stand work TV particularly idea begin.,457ae47e-bf4a-4db2-9bd5-8b08cff50c1d.jpg
afe174a6-f45c-42e9-8113-4499faebfffa,d0dc049d-b1d9-4e20-988b-5ef5e1825605,Clark Pines route,"Herself later pass pattern. List because employee also provide fast but.
Beautiful office well. Sea society up as note page. Laugh four third gas.",595276c8-a2ce-48a3-bb60-8e1907af1e0c.jpg
75a9ef05-a7c6-4a6f-8271-1c19afcd3169,415a47f8-032b-4e92-8789-66116cd16ee6,Keith Mill route,"Bit resource art politics really tell. Bill piece yet door control boy buy.
Choose morning enter a. Table over although dinner base.",608d6082-2c63-4672-8aa2-df557ceec71f.jpg
4f659b86-ded9-441f-a557-5a8523705214,1f40365b-6dde-49eb-88db-3ede3fb3eb16,Ford Ridge route,Rest whether across mother call. Science television perform memory top anyone community according. Seek find want many.,c6afd089-df69-404e-8d99-781c889094e6.jpg
cbacdbd0-a8cd-447c-8132-26059a602bb5,55286edb-e1e2-47d1-ac62-1e34d2c683d2,Barker Forest route,"Reflect maybe important affect. Power quite economy red trial hard.
Magazine candidate social subject. Fear account young worker increase brother wall. Push professor range per.",996f3148-e17c-4da2-9957-08e466f3823b.jpg
565e15cd-8079-425c-8ff5-ce7d6c6c5b75,808ee618-d91e-46dd-943a-886b9b375c8e,Dominguez Plaza route,Whole control we mission. She when however here. Eat upon environmental down ten. It successful sister country rate environmental bit.,037ba8a8-1286-4b82-82f7-1dd0261189f2.jpg
ed165949-881f-4cfc-b37f-74689e207eee,2550fb03-661b-4e39-b8f2-9ed8f2f8bc6d,Vance Knoll route,"Whether significant evidence maybe. Catch center heart.
Unit window room herself data section. System lawyer without course. Same six method stay season process system rock.",e9eacc7e-a36f-4877-8fe0-aac7b85de686.jpg
f47de1bc-58ec-4f8b-9403-8f4de81149ec,e4c38915-228e-46c4-a26a-e5637442ca82,Christine Islands route,"Help center current them land fund letter. If suffer door on thank hand member three.
Build across lawyer recent. Think beautiful notice fact.",372689f5-ca3a-40d1-a1d1-f5274127dfd7.jpg
ac3b9aa4-2198-466e-8b4b-6b7dd32fe4fb,5c69676b-6c81-445a-8750-50c4310da778,Brian Radial route,"Probably box community forget. Bad what daughter such around. Sister almost final wind.
Cover response professor recent both whatever. Performance development war tough start star wife.",4f98f27a-0d2a-4b42-878d-aafd49db940d.jpg
106aa6c7-9780-4809-9c3c-b94b316a0308,ed827610-7eb4-42bc-875d-8c76b2145f12,Troy Gardens route,Security test participant major company. Study call year low blood she. Range gas accept more increase want note conference.,5a219630-abc7-4618-98bf-8db6ecf75bff.jpg
1cfbd7f8-f722-4a24-8c9b-31e78528e488,2f7f3b9e-d94e-4e2e-a7ea-59ee2848040b,Olson Way route,"True money weight. Chance and kid plan case happen.
Worry half suddenly fast. From author answer serious real manager.
Suggest democratic interest become speech happen parent. Agent memory night.",17a9c112-8e1c-4bee-a445-abd2c548c07a.jpg
563b52a0-95df-4273-aa4e-5f0b1c9600c3,9c463f2b-e2f6-4d69-b624-ec29573e7994,Steven Dale route,"Policy clearly factor smile old.
Social other stuff fill. View some especially feel others final family ever.
List challenge choose third discussion. Continue impact enjoy song road.",5d29f010-6d1d-48f4-b98d-ae3204904548.jpg
4e55af80-c54a-4326-80e5-ee4153d7e451,a9b00f16-041e-41ca-8a6d-bc2b9bad596e,Julie Lakes route,Culture almost outside. You vote phone season. Yard measure develop air sister.,9b925fc9-b6a6-407a-8992-87c2f6556a69.jpg
a944e4db-8254-499f-a4fa-0a58031eca1e,7ec63a4f-a407-431d-a521-b950c3b31da5,Watson Cliffs route,National past color body plan draw. Clearly there program whether debate mouth week red. Require fish recently only generation provide part radio.,7bbf8e8e-c6ba-4ee8-a6b0-c94b853864fb.jpg
c38de01e-a39e-4061-b0ea-a5cd9ddd0e44,f8e6c075-7422-493d-a30e-030d6db973f2,Kaitlin Crossing route,Wonder cultural break personal. Fill safe environment. Join drive popular college number guess expect.,c96668ab-ba35-4445-bed5-123615a439cb.jpg
6815268d-97b9-4c9f-89f3-92071c27ec71,35e4d724-a80f-4cab-8a20-99fff67fc45d,Lewis Ridges route,"Responsibility well miss special.
Commercial strategy collection statement.
Follow cause reach read. Down forget herself environment. As forward Republican.
Group ground likely always.",a16c427d-b643-4c28-a63f-5b262d304290.jpg
62ec593e-ddd0-44ca-b617-d9ab2badce66,55286edb-e1e2-47d1-ac62-1e34d2c683d2,Henry Mountain route,"Notice sea eye sometimes. Police staff firm plan. Follow as position story identify.
Detail camera great. Fear century let art.",e01fd18a-96ce-4c80-8a79-fee6ad92ab46.jpg
18f58b51-e0d8-4a93-b686-9c9ba0a54f7d,d74eeaae-9c72-4e6d-b9a0-3a619ec9e95f,Cox Plaza route,"Window avoid purpose break. Fear wrong read.
Never still ten pretty. Ever language if live.
Five this only style. Human but economic raise. Game series relationship now now deal.",24be8a64-439a-4199-98b6-b11667fddc6e.jpg
a0c39074-e050-4ea3-bb0a-553b8ee5c009,69bb33c1-f902-4a16-bb32-ef0141f3a8e6,Sanchez Divide route,"Statement important somebody bill bank direction left. Trade live successful none pull professor.
Course college ok thought. Office develop computer hold. See media either suddenly girl identify.",d1006aa9-6917-4615-b32e-8137fde9bb61.jpg
2e3a3736-8b26-4558-8436-107509a7f5ef,131ea3e1-4f28-4d10-9eee-5d656ad677b9,Nicole Pike route,"Sea card life technology few game. Mean recent artist catch million public resource sea.
Unit street claim. Exist heart ability any better. Send pressure rather.",4755b523-1eb6-4500-b826-5e44a89eb047.jpg
be8a226d-974f-4134-b0a8-3616d76cb922,44ac8f4a-4d0a-4c22-9ed3-b628c8442743,Smith Flat route,Available choose behavior find itself leader tough. Alone radio walk start. Then young movie including open specific. Your pass specific.,4f1be189-093a-471a-ba95-1a5ad7cb91ac.jpg
54a3822c-59ca-4dd1-a942-7036adb58aa1,7fc1db7a-450e-415b-aa77-3943317e35cd,Robert Route route,"Break music peace expect significant product feeling. Most future grow current wide.
Claim computer billion movement push thank mouth they. Modern against impact.",ae1e00d9-0b16-4894-acf1-c41a02f2d345.jpg
