id,user_id,name,description,image_filename
dbdc4a59-3e44-4f00-affe-bfff6a262f42,4a396076-7e16-4f51-8bb6-997ba1770d59,Johnson Prairie route,Open eat mind result continue begin. Nation author suffer forward event unit. Own learn floor education close last approach.,d0d39656-f06b-4eb0-95ce-177f7cb7cae5.jpg
5f4dd399-ac63-4a21-af3f-b5d8b346366b,a88240fa-4fb7-45af-bb43-79d12b4753d1,Michael Pines route,Case company risk concern billion. Million question street they mother each agency. Under baby movie song.,96f76e39-755b-4c1c-84c6-3b6d2be5d38b.jpg
f6eefcdd-9a84-4106-8dbf-7f7cad1d3aca,8d65ce89-2870-4418-80b9-b6703aebff2f,Pamela Canyon route,Pattern employee culture tend PM usually way. Interesting go degree manager edge single sing dog. Act candidate everybody morning meeting.,cbfcf241-b694-4666-8742-b35e7d2dd7da.jpg
6a6b9274-977f-48a4-93ab-f5158bba4415,c8428771-d0a6-455c-9974-25fbab6675b5,Victor Ports route,Effort language possible cut despite. Popular stock evening series father. Since memory expert result site store hot. Today walk student rather simply.,e5358f91-ee3f-4ced-920f-a396f6b418a3.jpg
3d60cd5e-021e-43ce-b439-871afb45a391,c73113bf-c7d6-40ad-84a1-01799032b993,Wilson Divide route,"Raise upon that cover responsibility yeah floor within. Total maintain because law news final help.
Weight news race. Industry ten show lay. Perhaps different occur indeed carry.",b7f19807-f4f2-4fc0-84d8-6787e77bb477.jpg
e8790754-54b8-4ec3-aae2-fa8cde5a2986,d55bb729-a7c7-4f6f-92a2-e926ce4bb1fc,John Trail route,"Try time guy plant commercial about. Whatever open over ability indeed.
Example election school very movement. Trade may between east responsibility. Maintain stop tough worry spring wonder.",76583789-9ba8-48cb-9d0a-da4c14e9a90b.jpg
e2ac549e-8b41-40da-bfef-f7d97e486088,27637d0b-0ba8-4b5c-9aea-c9260d945b33,Bates Forest route,Yes identify bar hear. Skill people consider else age hard reach. Guess her total personal cover get team.,1d495452-aa79-4fea-bd51-62a3c7f28890.jpg
58ceedec-d368-4c39-85a0-ba6db90d09bb,e236dcd2-0889-431d-a24f-ffea7c5bb139,Holmes Isle route,"Plant recently subject represent. Mother positive thus above go garden sense. Reason owner day issue customer piece happen.
Life party commercial wish. Down model democratic southern.",f743561a-55c5-4087-be2c-3ada820152b4.jpg
96dab012-adfb-439c-b376-9a5a4d2e1035,27ebc4e8-1799-4b47-aa9b-b591d90f871d,Rachael Keys route,"American but difficult religious identify fast. Campaign compare go address as magazine.
Street contain color hard see strategy phone. Color least others bad.",05e70c93-3914-4c59-831c-31312eeaedb2.jpg
f313ff7c-d071-4844-ae38-620f427f3d0c,1ac156f7-e9cd-4bd8-90c7-486cd422fd25,Shannon Lock route,Night necessary attention because. Action degree kid window plant.,f3d0c0af-671d-41ed-baa8-9fdf5164c662.jpg
55eedd38-c0d2-4fcb-aaff-5bbd70989854,0aceb8ae-8d81-4922-bafa-f5fbce534293,Victoria Village route,"Son improve house. Give talk affect develop end.
Both we skin avoid. American whether allow mission. Notice skill product.",2c5cee1d-7d84-484f-b47f-bae6800af4b2.jpg
86585d40-0f2e-4e1a-8877-9f25f5274aa2,ae5546c2-47ea-45e8-87b8-3c5afa405316,Rodriguez Loop route,"Movie local evidence note seat score player. Special decade we smile manager. We room learn concern save market set.
More write seek that. Land century choice herself activity very interesting.",e125dfa5-df55-4b9f-9343-1f5acd081384.jpg
f637839c-666b-4869-a7c1-fce2f1d0c789,c4c34d0a-eaad-4684-b115-fb4ddb6cb198,Cummings Expressway route,Eat method join less deep hope list. Arm a attack take.,808e5516-6a24-4a4d-9108-806e4d30b785.jpg
6bbcb3b6-40cb-4c42-a44f-f673e8e0a59f,640859d1-fe79-48f8-acab-38dee25999b9,Justin Island route,"Popular clearly next major way century. Religious indeed want.
Similar summer world resource add. Authority action ready student state region baby. Relate recently sea.",b8f8b381-0fc9-4bb0-84ae-02e038359cc9.jpg
e1a99f9d-a5ef-4a58-94d8-111084ad86d1,fabb0185-6a7c-476e-81a4-f63b54c6286f,Matthew Run route,"Happen have real still public myself you. Focus seat their in what year.
Raise white hear professional four. Despite difference wind amount check government well.",91d42d14-dc05-43ea-815e-de10f65db7d1.jpg
6f907cde-bcdb-452c-b06a-c8e82af01bde,705dacb9-b82e-4127-a362-ba003c702285,Chelsea Springs route,New television range clearly. Resource open month allow near fly. Traditional which better probably. Whether ahead fire main particular air.,cfe3bdc7-5215-48ae-b488-e502bc9a5924.jpg
a7454164-017f-4ac4-b533-f6882b79f4ad,8ca9576f-c05d-48f9-98ce-5262debdde88,Christopher Rest route,"Simple base college single fall care. Politics forward material.
Visit truth wonder. Box institution build hour act.
Religious music fast. Approach board account job.",27a748c0-7e85-45b3-97da-8096976c9193.jpg
51185bf8-aca2-40e5-985e-029db0517729,54ba435a-2246-40bf-b9f3-3693cbbb790d,Amber Mountains route,Voice computer community few interesting these. Model leader situation necessary everybody gas. Investment form pass family.,88d4d060-17a1-4c97-9af0-ed64507f82d6.jpg
11ecef49-ce89-4e18-bfdf-273284c148ee,521450af-6785-421d-9f25-6f602152205e,Mark Ferry route,Any miss care result always policy. Home each relate recent agreement out. Meeting cover most hand example also. Voice very guy role young almost card party.,27a504e8-0e65-433f-bb70-f5471d5aaf8e.jpg
9430fb95-04bf-445c-8116-0874312463f8,41eadca3-e790-472d-a989-6902846993e1,Crane Squares route,"Surface miss song personal. Doctor beautiful soldier lose right.
Energy future its court walk environment. Two property church explain anyone. Member lose this inside them.",b46acdf1-26ab-4794-830a-957be5bab135.jpg
3056f6fe-a352-4241-897c-a873ee4f254e,44ac8f4a-4d0a-4c22-9ed3-b628c8442743,Alicia Gardens route,"Customer soon happen heart throughout. Least art through forget hand worker.
Also stop that plan set. Walk ten beat bit poor but smile. Admit rate certainly natural design course kitchen.",3ea21276-233c-447e-8afe-bcf739566218.jpg
d36b05a7-13b3-4a16-b2d2-6c9e462b9ee1,c9c2887f-4e20-4b24-9571-a8760feb3cf3,Porter Orchard route,"Find sort dinner. Such common reduce.
Class floor red. Business bank data successful.
While assume factor firm. Break still magazine and. Similar affect history bed eight year.",e01f26c1-c679-4f37-bc0e-f6b397d631bf.jpg
4950f786-be90-4c5d-b553-6b3b56fef639,c445847c-b800-4fe9-8ffa-4600a0152578,Christopher Springs route,"Within success process half television program cell. Hope western everything pay.
Cover budget do. Economic without past. Control toward read past easy any drive.",ddb5fbeb-cc4b-4134-bced-897b8ac7c0aa.jpg
192071ae-4f06-4793-a8f3-c51bff5bca10,be0c4021-f48e-4c77-92ce-d12e1f339645,Soto Rapids route,From large artist lose attorney despite pull. Become student business. When evidence fill place answer partner.,cf845fd4-678d-4a3c-80c3-4bf73018367c.jpg
b8b35197-0e73-4667-95de-b6df5ba98760,b7d22f79-5c43-4ae1-ad8f-1d956a61ef97,James Manors route,"Account manage thousand century produce. Writer bed next read.
Issue brother mention. Month agree star.
Lay mouth ok try story sort dark itself.",ba55d21c-6eb3-4b9e-9dbd-a544fc18ce12.jpg
3a296f38-73e8-43c3-ae11-f75415f930d5,fc7841ed-2b9e-4a11-8654-fa8a22a5b647,Joshua Underpass route,"Range me father leader order skill population. Fire within politics later.
Hospital future religious. Fight receive who option high. Wide close life benefit.",9224cd3d-146e-4bf9-b997-3605945740a1.jpg
6d63444f-138a-4f41-bce8-55f69e13f3bb,f612b0f7-e4d6-4ce5-bc96-5875df99f93a,Guzman Points route,"Some sit call recognize concern turn would.
Local list by power card serve traditional. Threat defense lawyer usually employee lot. Local four will question.",9ff80229-a295-4ce3-9ac7-7367bfa8ac39.jpg
220cca9f-be48-4a47-a4af-7b921db40562,a39427b6-ca6f-4492-a926-a0f1b9e2b339,Jennifer Wells route,"Position soon sport despite particular newspaper. Thing community ago term particular. Last simply deep here.
Wish follow will.",a989d5e7-8d43-4712-8e50-d498c4c3db58.jpg
9138866f-4028-465c-bac6-796e0c7fa324,c3da9e9d-961b-4042-9812-6f552879bc91,Valerie Knolls route,Security dark skin admit believe wear either. Back while tonight who be and. Suggest watch the total. Service task ready couple operation establish their.,e947ab4c-56ec-43a1-b5a7-34cf0a21e747.jpg
2f747df8-994e-47c8-b55c-1bbcafaa189c,aa99741e-c29f-4d7f-8cb5-bf9ea6a0256b,William Mews route,Contain act recognize deal defense deal everybody society. But defense president control structure.,67a7b462-085e-4601-808f-f34b0da815dc.jpg
f493b4df-bb3a-4788-b57e-1fc086b25437,538575f4-1ce6-41b1-8392-b7ad2afd937f,Katie Inlet route,"Democrat popular tree yard appear. Least make hot near man begin. Air just fire technology member.
Door hotel become certain admit culture agreement. Range peace far I unit board prepare fire.",d0f750d6-fb02-4bb5-95b4-57e4381871f5.jpg
f2575d69-5fb2-433f-b129-dcba0cc0a5f9,05f46e05-8793-4da2-8ea9-f5a096e36e3c,Kyle Coves route,"About mention respond nature. Man speak resource investment market. Around culture player result.
Sea organization worry form as crime. Scene energy too.",2fa8c156-a200-4ef1-825b-b39b89b13da6.jpg
155c0ceb-8e58-459f-b391-a26424a7d49b,6dc9074d-2b2c-4fe8-a523-dbab8f14012c,Bates Glen route,"Front Mr organization option. Raise thousand bad finally.
Quite quite interesting industry everyone talk.
Cause however begin involve respond father wish old. Strong too business least.",669d75a5-e98a-4808-9837-a50a304786fc.jpg
4c08a94a-c47a-4df9-8f6b-079201410d1a,bd2f4a81-1c67-4238-9400-192448d9ee9d,Small Estates route,Month when bank throughout. Baby other first spend television far loss. Family candidate today night.,b533710d-d3cc-455b-9b23-c4100fc8aee7.jpg
a31bf366-02a3-47e9-a29f-aa9de59dfa7e,b569e60a-9f86-453d-951e-b3d5b1c929e1,Grant Stravenue route,"Movement care garden live against glass. Leg red day consider again wrong.
Like drop situation national admit because. According hear home business. Maintain suffer more teach.",f52a1d1b-ec3e-4ead-ac60-ae99ecfeb5da.jpg
945eccc1-e0d0-48b7-bc10-d0acf0a418df,a1863af9-7754-49e9-af5e-9eb86e1b72ec,Brown Springs route,"Director whose medical lose much. During president player current.
With law any. Traditional positive structure determine police. Second option unit my stage mother possible.",8328c9a5-11b2-4479-8d29-0beaa7231ae2.jpg
f374ccaf-aae9-4843-bead-d556692abc78,4d592a23-a9fa-4afa-a8fa-c7aebec526ac,Turner Mountains route,Customer character girl development girl business really become. Pass billion program front computer. Evidence oil end name bed message factor.,cf5f0750-7d94-48c3-85f1-db40447262e0.jpg
065ff30c-2f10-4597-aaee-eb792acdb75b,78b7cb8b-db61-4ee5-b549-dd6aa047d0e7,Diana Glen route,"During friend student forget front a.
May charge kind right enough gun. Food expert himself number far what by.",1de8608f-f2d8-4704-be55-f08364125cef.jpg
8e1f78f2-bb64-42cc-84dc-a55c0e12dcb9,3990c3ce-0258-4234-8d65-7b9c4cb9be0c,Danielle Ranch route,"Against agency interest kitchen. Wide source senior.
Section draw section majority continue. Red but bring citizen.",150f3cdb-95f0-43f4-b528-ae519d6d41d8.jpg
0b793556-47e2-4c2d-b17d-9534d9965144,95f35808-3c58-4418-abf0-d3083d700c2f,Anderson Green route,"Tax space war indeed. Yeah minute actually stuff technology majority forward old. Soldier perform second stage imagine series.
Black various cup receive. We phone ask practice.",849ddd1d-4558-46db-b672-563bec97158c.jpg
2aa6a5f7-8f27-4217-a281-b3c62c16a609,e09d4e47-e7b0-48f8-a983-12d91869d051,Howell Ferry route,Appear public image force kid about short political. Commercial happy lead main. Audience now project perhaps majority.,50d90028-1dac-4746-a1ab-08e9989de562.jpg
73809d24-6463-49c2-b386-95dfcb1f52cb,7524b1c8-9c3b-47c7-9ac0-152f898e644c,Jessica Island route,"Each performance tough to. We prevent hand.
Something scene look task. Ahead rise else ability bank suffer.",1a26daab-8e64-409c-ba5e-502575d8f5e1.jpg
55dc7bfd-d4e2-4fde-bcd3-db7a2e5e3f01,9c6e40e3-945a-48e9-8d61-9b065f1cd28a,Gabrielle Crossing route,"Appear season certainly. Seem age often perform.
Conference skill director fall. Decision mother together space husband just difficult.",7b1f4ccd-d62f-44e4-ad3e-7ab8b3757ce8.jpg
acfa964a-9d0d-4c32-bc22-8d2a64036b38,d99466db-5174-4795-9247-805b000f1863,Donald Divide route,"State south choice well. Drive day benefit effect voice view time fill.
Religious idea medical drive. Activity report computer however region people reason.",b8018b27-2656-4262-b6a7-12e517dd9f3b.jpg
4e771cec-bde7-42b2-a63e-92b5aba41b31,2f0d22e6-abf2-4200-b5b8-27d47cbc5a9e,Martin Avenue route,"Design indeed interesting candidate role parent. Suffer stop inside. Scientist hard those decade player ask why.
Option defense fear morning find.",214f1755-2199-44e2-a72b-eb61bc23f670.jpg
fe16407c-b36a-4132-a7b4-932f7cf2db0c,a3815606-12c9-4dc1-aa56-91cf734f60f0,Donald Plains route,"Write game early. Way so government. Effect instead important man ahead.
Animal apply card thought. Add work woman. Maintain answer put dark serious.",3940f61e-24c1-44fe-8138-30e87122c1d4.jpg
ddebac47-bebe-4aa9-9f9d-ef0ca3dbcd06,c6c5e369-7916-4caf-a7e7-2e81bb096d94,Kathleen Rapid route,Back business build manager ability total. Sea as medical federal program method. Mother commercial black politics themselves clearly majority.,9af9eabb-8a8b-4303-a1fd-280241f9e82c.jpg
ad777826-38ab-4b9d-b305-c2cb239ed675,ec21011d-270a-4414-b539-f79adca1b033,Teresa Springs route,"Daughter parent yourself lawyer style difference nation hotel.
Benefit town still hotel claim. Benefit land eat our participant.",54c33c01-769d-4c21-ad31-d40ad3e4239b.jpg
1d8cc396-b0cf-49f8-95c7-719a19e1f544,0726a7d7-d086-4126-b443-8f1475d5a695,Andrea Club route,"Performance cost collection bill sing for kid pick. Involve building hot occur them number.
Thing administration better day push continue outside return. Consider easy middle lose design.",93ec204e-b71e-4f9d-8da1-6600df6df523.jpg
c0f639df-6dac-4b6f-9eb9-8a44eec2f26a,82a3ad03-2839-41f6-a80e-c8eb6b06d381,Schneider Ports route,Century describe by range consider. For sort purpose pay. National describe talk nearly many wall indeed.,fd2bf51f-b909-4807-8e4f-aef5e19128f2.jpg
be0b3411-870f-4c3b-9e53-19bd14bc96ff,d0dc049d-b1d9-4e20-988b-5ef5e1825605,Robert Square route,"Line large TV guess family black million. Program activity old hundred to. Cost per beyond article group.
Picture why cultural policy best single case measure.",af15b955-0144-43f3-aca2-032acaecc59c.jpg
dcabfd33-9c52-43af-93b9-e0ce0b186731,e12a23ec-5318-4c44-9826-498e15aadd49,Timothy Crescent route,Any important month stuff. International spend term military morning. Must without hard standard a thing.,76fe2d5a-5748-4c0e-9bb3-e7f2bb957c4f.jpg
049988a7-e687-49df-86b4-6e5208db4c2c,d439b7d8-dd0a-4fa7-ae2f-c22ae8de68e3,Crawford Fork route,"And democratic condition coach region. Word agree program west new nor listen true.
Oil staff seven benefit. Investment especially international response politics upon citizen write.",df5c44e2-a096-445a-9eb3-875ccd0e6c2f.jpg
0ad46b0a-1bef-46c8-90f6-7399afe59726,7ddc8bf3-81a3-4e57-b4e0-5bb18cbeab27,Torres Corner route,"Sit he term president treatment. Federal writer we same talk.
Guess hope low foreign manage and simple. Computer main especially walk media son nothing. Add seat science color hotel.",a3d78946-876d-4495-8e69-78d328ca2fd1.jpg
b658d4cf-718f-4e74-96e9-27527ca1f5d5,19450680-f47c-479a-a3d4-a741320ab42c,Danielle Falls route,"Tonight actually money anyone him debate include. Five scientist modern yard star happy.
Behavior find lead everyone without off. Billion friend top various figure education actually along.",4b1508c8-2ace-4cad-be3c-b62807a04347.jpg
d222ec55-0318-4ea5-9075-c7f1fd80d1e8,bf5e4ec7-c69e-4bc4-8de6-59ab2c8ff2cf,Hart Isle route,"Role occur price in close choice commercial. Clearly seek painting agreement. Network building must behind.
Century mean answer method. Ahead use different analysis pick agent.",e8201826-920a-4cca-a04c-894f1cf55a47.jpg
cf4e0eb9-f7bb-46ac-9224-af2fb8b3fc90,3d38d287-6194-430b-ab6d-8a899d622e4a,Cantu Forest route,Development bill couple apply. Rate skin trouble mouth response. Environmental economy place miss stock PM.,f19f6c75-b188-437c-86ef-793fb6da2c2f.jpg
502a4d04-6dea-4a0b-9e17-d288ef1a1113,2d40ce53-425a-4477-9bb0-ee436b4c31a3,Maureen Inlet route,"Respond rich relationship point believe court they. Another type choose nothing it technology concern check.
Character left prepare because blue important agreement. Single personal whether me.",6c5a93bf-9ed6-4807-8a9a-53fa0a199632.jpg
2ada824d-ca3f-4021-891e-861da1cba54b,38ade41a-6736-49b6-9bbd-a00128862577,Valdez Mills route,Can western hear life others. Garden order child them value. Read article another behind cover food. Leave offer watch effect relationship decade.,62271276-01aa-4b06-9e71-980f50506e22.jpg
4278a83f-db1a-4f59-9072-375e3ec02f6f,a9254a13-61ef-4f9a-be98-badd26e805db,Erica Drive route,"Week kid three analysis bad. Similar director TV court bed sit.
Mouth avoid others discussion source. Reveal someone region cold hold TV. So discuss four.",3dbfb8de-29b4-43d6-833c-47b4ac3d52a1.jpg
2b58971e-8953-4e02-bd6b-3a2cd48f860a,87518e6d-05c6-4357-ad97-c00420f568a6,Villa Estate route,Traditional wonder speak city hope should. Standard finally state ever best because.,e6a09891-3c21-4c6d-b568-5bdba64f6f43.jpg
431aa981-fbaf-41ce-b24c-445a75a76d90,f2d986b2-267f-42b0-a30d-ae1b2ef24455,Jessica Trail route,"Raise society far. Machine huge direction case within human require government.
Morning it fact break area program. Natural region bill red old.",f27efbaa-bd0f-4cc5-8635-344581c6d3cc.jpg
e9785f49-c7f8-47b2-9ae3-92e73e44a5be,7d80ca83-012d-450d-80f5-c5a747888ee1,Castro Branch route,Program like just matter worry them step a. Red amount fly claim consumer near tax. First hand cover bring pull as again.,2910169b-2e76-48c2-a953-3fa8182aa425.jpg
50afb739-abf7-4143-9738-d850818d1391,315227c2-6b04-4964-bdef-096f133075e1,Nicole Shoal route,Management force during ok ago only magazine image. South audience consider court personal. Head soldier street alone.,5571eae6-8460-4a21-9bc1-1991c5ad7e3b.jpg
7bc4abfa-ea36-4450-9c60-6c93e1160ba1,7209fb9d-f179-4049-83c9-93af22d2cd42,Barrera Village route,Score also option issue moment. Month tend item than. Camera book culture onto.,1122f34b-37a2-47c9-ae3b-b65c81edcb5d.jpg
84147cd3-f3c7-4dc0-ba53-0caf5934d006,4af74e2d-9fe8-4bac-a592-4b5f9142d22f,Allen Trace route,"Cost dark one. Even past customer hope sell cut.
Them than fact tonight son.
Doctor growth possible. Sell represent fact call international term own. That organization offer think dream huge.",db6fb9cb-6c9b-481b-a8a7-3b340757eb78.jpg
d3ceb42a-6678-4ec7-8e3d-219a771c2c4b,3b4efb89-f5de-453c-b6f6-0396cfb27804,Monica Hills route,"Response particular region others effort. Worker time business discussion team husband.
Tv game future drug.",e58be915-527c-4c2f-b43f-dfd513eb07d3.jpg
ba6ed186-2e5d-4e7a-9765-ced460f46bc2,19680e99-247a-4ce8-be36-23fd74be8b66,Kristen Inlet route,Bank sing theory way. Peace bed life create west citizen. Wear campaign stand alone back expert become. Find short follow region.,d697eb37-058b-43d2-a189-142646bf4e92.jpg
d525f842-d3d5-4762-8d5d-c16988c62e90,705dacb9-b82e-4127-a362-ba003c702285,Jenny Streets route,Home research memory political so. Represent their everything anything. Much might pull large race parent.,018cab34-7f62-4718-a016-b1c83cfa251e.jpg
eb1b2fe7-3af8-47ed-aa90-cd67e469e966,d8f303b2-1391-43bd-b535-820d485331c9,Maria Knolls route,"Despite impact spring item analysis. Listen data as sit energy sport be.
Able decade social foreign personal manage doctor. Such parent dark say hair five national.",cbe574a3-ff8e-4b90-919c-67cb722876a3.jpg
450d2375-d545-440a-b71d-306063cb985f,8426a217-b20a-4127-998a-66bced497a5c,Travis Drives route,"Activity go Mrs develop job daughter baby trouble. Wife news group field catch. Such less learn me.
Memory step board ability notice tree TV. Do toward position choice season.",47e135b0-9573-44e4-b10a-6b520c9f96ce.jpg
3458365e-f84f-4be4-a5c8-661f344d91e3,120e9258-3b97-4b65-8264-f02ddd2f075d,Charles Stream route,Run magazine guy responsibility cold appear. Agree join ability even thought.,746608f4-d069-4348-a96d-5597c5061e06.jpg
5a662ad3-80fb-41c7-a075-2bbfe5efe694,a9e60f74-cde9-4e53-93d6-75a2e783d4c8,Meredith Station route,"Service result fact federal store hotel apply. Others computer door by decade.
Director like that. Leg young never gas fly later natural. Career role bank force.",190f1e43-f116-42ff-8800-f433ef833635.jpg
393d44a9-44ba-4a18-9195-cc1885e78be2,eff6051c-bc9f-4248-965b-3e07c73381e0,Steven Lane route,"Against career could. They describe measure paper. Issue himself entire exist behavior watch open.
Audience direction line understand. These week first mention season would least.",cdccaa05-7e90-4b4b-ac90-ef516c4ca695.jpg
71907350-0a34-4769-bf06-5cecf37d2513,66e1f211-81e4-4010-a55e-fb346f789b9b,Walker Forges route,"Ever plan big lawyer individual. Especially low now about strong home me its. Unit person cause necessary.
Group recent kind thing safe. Thank kitchen machine. History decision church peace wonder.",3b844083-773f-47e8-9945-4ea486e4f95f.jpg
7b87c32d-81b3-43c3-9080-6fb35c565c13,7bede026-71a6-414c-8b2a-d0555ae0c084,Thomas Ports route,"These must big treat tax such upon. Course use event strategy people prevent listen.
Cut evidence end southern. Beyond these American deal.
Which poor air result. Hotel wind figure run about why.",d419618b-1577-4e8d-aa58-a634b468ca8e.jpg
ac01f918-bace-425f-9f73-3b99e835cd21,c74419ce-d3c9-44ad-949e-2790e685aa74,Kevin Port route,"Family side prevent spring. Stuff worker section ahead. Explain growth person road herself.
Door music trip born. Whether work tax door camera build amount. Station watch stay assume.",75f7dc6f-f581-4c58-9cad-f4a2e87e514f.jpg
4e6b06bb-6110-4b36-9d2c-da1b1bb49713,7d80ca83-012d-450d-80f5-c5a747888ee1,Knight Lights route,"Order civil fast say dinner small phone. Avoid check large rock everything Democrat. Season mouth training scene your wife.
Attention season reduce begin receive senior understand.",bf3ea1f5-90ab-409c-856c-86fcf3392545.jpg
2667508c-2f81-4473-845f-8f35790654fc,cbc02710-631c-456c-bdc4-eab69ca42a41,King Villages route,"Your recently raise effort language and bit court. Beautiful drug rule few program world.
Lead church know her degree.
Place other recognize prove do west culture.",fdc949b0-e1e5-42d5-85a7-8465d70a85df.jpg
5506d95c-967a-4a23-849c-539613ef1736,5c69676b-6c81-445a-8750-50c4310da778,Graham Rest route,"Finally attack so than. Camera serve middle still international. Would statement someone send become.
Me throw us during. Trip behavior ten population from. Keep decide space month office send dog.",8115efa1-edf1-463f-9b0b-7bfe1098a8f0.jpg
dae2ec9a-c83b-44de-bcf0-bfe72bd14b8b,7d0ab4dd-f1f8-42b9-8c39-32cfed48aca1,James Common route,"Brother heavy south value. Result onto over. Exactly would peace about same have.
Your hour road thousand authority just six. Heavy front economic guess safe draw low air.",e5a9153a-cb24-4752-8dfe-223c3d534937.jpg
7c852714-1ffd-48ce-958a-67e868934cdb,e0b83bfc-5b09-4ed2-b8ee-59857a0fbeb6,Walker Pass route,"Glass hotel particularly medical. Significant none keep.
Protect near eight ground be.
Network enough large. Likely business street before by. Thought share step finally various.",d21b7068-241a-4372-9471-34c427d51bbe.jpg
05784952-151a-4fc6-838c-0c46fbe25519,fabb0185-6a7c-476e-81a4-f63b54c6286f,Campos Lakes route,"Right consumer despite cup news. Bit president clear tell really structure bring let. Window maybe need.
Child maybe one. Often opportunity also those group will record.",53fdfca1-a8b7-403c-87f4-38b19c111cc5.jpg
beee96f8-aa74-40b9-989d-1a38f730ae2e,f6478c91-5140-4e3d-a556-ca0b14f9d52c,Joshua Mills route,So charge central defense usually ball. And detail seat so catch war. Partner explain win wonder through carry.,ca44722a-56c1-4ca9-9ee9-b28e3427bc35.jpg
bdbbacc9-73b3-47f0-8538-171210eca558,392ec96d-b1fc-4ddc-86a2-21b303437b6f,Williams Valley route,Face chair amount action or. His another pressure center enter land. Factor wall customer out.,2f885c11-f0b2-4df9-9f30-bab05e79089d.jpg
5476ac5e-3765-4e95-826a-ddb05b285ef3,182ff4f2-8278-41d2-8440-03ef04b019ef,Hill Curve route,Ground yard ago model without. Since win executive performance girl well alone. Attention voice amount challenge trip which prepare. Property right surface participant change place.,414f6778-da1a-4660-9097-b506db87f054.jpg
46f2d61a-7238-433b-946b-bc27d4611f72,ff1a8ec5-1d52-43d0-91dd-a16d3419571c,Arnold Dale route,"Daughter soldier heavy friend myself by. Enjoy bad kind weight either beyond.
Ahead light difference relationship goal. Learn type produce return admit child share.
Professor during good actually.",ec5565e6-0212-4c70-8eac-3c67f102077d.jpg
22596f65-8d4b-4aa8-b2a3-86e3d0cfbbae,fc4866a1-2de7-4436-9870-8aa32b613198,Sharon Route route,Early look certain available reach miss city. Maybe western question list. Against consumer buy political majority bill company.,65361826-ffd7-48b0-af40-8ea8cbc7f74e.jpg
ad8865be-0cbe-4eb0-ac1b-42bbe7d6c844,e3db3a39-8454-4d44-bba7-ded82960e52c,Moss Views route,Stock degree event position stop anything. Water product respond. North next individual exist behind.,cdcf75b4-0af4-4830-82e7-20a4bb83d88d.jpg
d3e963af-9ee5-4ff4-aad4-69d948fe1182,260754d4-d34f-49ad-9cc6-3680b1ec9bdd,Richard Path route,"Tonight chance begin discuss let. Become want language tonight write dark. Matter I treat hair kind ten yourself.
One talk market. Student as Republican sign finally drop see.",5ee30184-5026-477f-99e5-387a574daee9.jpg
6a9fbcd0-713e-49ea-b320-f1cab2b940e1,96b3816d-cbb2-4711-9481-08038012510b,Wong Highway route,Research region realize church here such. Amount budget he today body. Human reflect government affect start simply. Finally bed several three full.,2b9810f5-8d72-4c71-b477-c4bf01119191.jpg
